title,description,short_description,category,stock,price,regular_price,sales_prices,weight,length,width,height,sku,picture,tags,tax_status,tax_class
Air Wick Freshmatic Compact Fruit Medley Cocktail 24ml,,,Home & Lifestyle->Home Supplies->Air Freshners ,,7.49,,,,,,,HLSHSAF001,HLSHSAF001.JPG,,taxable,standard-rate
Air Wick Scent Ribbons Vanilla Sugar Sparkle180g ,,,Home & Lifestyle->Home Supplies->Air Freshners ,,9.99,,,,,,,HLSHSAF002,HLSHSAF002.JPG,,taxable,standard-rate
Air Wick Scent Ribbons Apple & Shimmering Spice 180g,,,Home & Lifestyle->Home Supplies->Air Freshners ,,9.99,,,,,,,HLSHSAF003,HLSHSAF003.JPG,,taxable,standard-rate
Febreze Candle Meadows & Rain 155g,,,Home & Lifestyle->Home Supplies->Air Freshners ,,7.99,,,,,,,HLSHSAF004,HLSHSAF004.JPG,,taxable,standard-rate
Febreze Candle Eliminates Odors and Freshens 155g,,,Home & Lifestyle->Home Supplies->Air Freshners ,,7.99,,,,,,,HLSHSAF005,HLSHSAF005.JPG,,taxable,standard-rate
Glade Candle French Vanilla ,,,Home & Lifestyle->Home Supplies->Air Freshners ,,4.99,,,,,,,HLSHSAF006,HLSHSAF006.JPG,,taxable,standard-rate
Glade Candle Apple Cinnamon ,,,Home & Lifestyle->Home Supplies->Air Freshners ,,4.99,,,,,,,HLSHSAF007,HLSHSAF007.JPG,,taxable,standard-rate
Glade Candle 2 in 1 Fresh Berries and Wild Raspberry ,,,Home & Lifestyle->Home Supplies->Air Freshners ,,4.99,,,,,,,HLSHSAF008,HLSHSAF008.JPG,,taxable,standard-rate
Glade Candle 2 in 1 Creamy Custard and Apple Cinnamon ,,,Home & Lifestyle->Home Supplies->Air Freshners ,,4.99,,,,,,,HLSHSAF009,HLSHSAF009.JPG,,taxable,standard-rate
Air Wick Candle Warm Apple Pie 120g,,,Home & Lifestyle->Home Supplies->Air Freshners ,,9.99,,,,,,,HLSHSAF010,HLSHSAF010.JPG,,taxable,standard-rate
Air Wick Candle Apple Cinnamon 120g,,,Home & Lifestyle->Home Supplies->Air Freshners ,,9.99,,,,,,,HLSHSAF011,HLSHSAF011.JPG,,taxable,standard-rate
Air Wick Freshmatic Mountain Breeze Refills 180g,,,Home & Lifestyle->Home Supplies->Air Freshners ,,7.49,,,,,,,HLSHSAF012,HLSHSAF012.JPG,,taxable,standard-rate
Air Wick Freshmatic Sparkling Citrus Rills 180g,,,Home & Lifestyle->Home Supplies->Air Freshners ,,7.49,,,,,,,HLSHSAF013,HLSHSAF013.JPG,,taxable,standard-rate
Air Wick Freshmatic Vanilla Passion Refills 180g,,,Home & Lifestyle->Home Supplies->Air Freshners ,,7.49,,,,,,,HLSHSAF014,HLSHSAF014.JPG,,taxable,standard-rate
Air Wick Freshmatic Fresh Waters Refills 180g,,,Home & Lifestyle->Home Supplies->Air Freshners ,,7.49,,,,,,,HLSHSAF015,HLSHSAF015.JPG,,taxable,standard-rate
Air Wick Freshmatic Lavender & Chamomile Refills 180g,,,Home & Lifestyle->Home Supplies->Air Freshners ,,7.49,,,,,,,HLSHSAF016,HLSHSAF016.JPG,,taxable,standard-rate
Air Wick Freshmatic Harvest Spice Refills 180g,,,Home & Lifestyle->Home Supplies->Air Freshners ,,7.49,,,,,,,HLSHSAF017,HLSHSAF017.JPG,,taxable,standard-rate
Air Wick Freshmatic Compact Fresh Waters 22.7g,,,Home & Lifestyle->Home Supplies->Air Freshners ,,7.49,,,,,,,HLSHSAF018,HLSHSAF018.JPG,,taxable,standard-rate
Glade Sense & Spray Lavender & Vanilla Refill ,,,Home & Lifestyle->Home Supplies->Air Freshners ,,5.99,,,,,,,HLSHSAF019,HLSHSAF019.JPG,,taxable,standard-rate
Glade Sense & Spray Clean Linen Refill,,,Home & Lifestyle->Home Supplies->Air Freshners ,,5.99,,,,,,,HLSHSAF020,HLSHSAF020.JPG,,taxable,standard-rate
Glade Tough Odour Solutions Clear Springs Refill ,,,Home & Lifestyle->Home Supplies->Air Freshners ,,5.99,,,,,,,HLSHSAF021,HLSHSAF021.JPG,,taxable,standard-rate
Glade Air Fresher Clean Linen Electronic Warmer + Refill 8g,,,Home & Lifestyle->Home Supplies->Air Freshners ,,4.29,,,,,,,HLSHSAF022,HLSHSAF022.JPG,,taxable,standard-rate
Glade Air Fresher Refills Clean Linen 2Pk,,,Home & Lifestyle->Home Supplies->Air Freshners ,,4.19,,,,,,,HLSHSAF023,HLSHSAF023.JPG,,taxable,standard-rate
Glade Air Fresher Refills Apple Cinnamon 2Pk,,,Home & Lifestyle->Home Supplies->Air Freshners ,,4.19,,,,,,,HLSHSAF024,HLSHSAF024.JPG,,taxable,standard-rate
Glade Candle Refills Blushing Berry 4Pk,,,Home & Lifestyle->Home Supplies->Air Freshners ,,4.99,,,,,,,HLSHSAF025,HLSHSAF025.JPG,,taxable,standard-rate
Air Wick Freshmatic Auto Spray Warmer + Montain Breeze Refill 180g,,,Home & Lifestyle->Home Supplies->Air Freshners ,,15.99,,,,,,,HLSHSAF026,HLSHSAF026.JPG,,taxable,standard-rate
Air Wick Freshmatic Auto Spray Warmer + Sparkling Citrus Refill 180g,,,Home & Lifestyle->Home Supplies->Air Freshners ,,15.99,,,,,,,HLSHSAF027,HLSHSAF027.JPG,,taxable,standard-rate
Febreze Noticeables Warmer ,,,Home & Lifestyle->Home Supplies->Air Freshners ,,3.49,,,,,,,HLSHSAF028,HLSHSAF028.JPG,,taxable,standard-rate
Febreze Noticeables Warmer Refills Morning Walk and Cleansing Rain 52ml,,,Home & Lifestyle->Home Supplies->Air Freshners ,,10.99,,,,,,,HLSHSAF029,HLSHSAF029.JPG,,taxable,standard-rate
Febreze Noticeables Warmer Refills Clothesline Breeze and Meadow Songs 52ml,,,Home & Lifestyle->Home Supplies->Air Freshners ,,10.99,,,,,,,HLSHSAF030,HLSHSAF030.JPG,,taxable,standard-rate
Glade Sense & Spray Auto Room Spray Lavender & Vanilla Warmer ,,,Home & Lifestyle->Home Supplies->Air Freshners ,,9.99,,,,,,,HLSHSAF031,HLSHSAF031.JPG,,taxable,standard-rate
Glade Sense & Spray Auto Room Spray Clean Linen Warmer ,,,Home & Lifestyle->Home Supplies->Air Freshners ,,9.99,,,,,,,HLSHSAF032,HLSHSAF032.JPG,,taxable,standard-rate
"Glade Oil Diffuser Starter Kit Pineapple & Mangosteen 1 Holder, 1 Diffuser Card and 1 Oil Bottle 20ml",,,Home & Lifestyle->Home Supplies->Air Freshners ,,8.99,,,,,,,HLSHSAF033,HLSHSAF033.JPG,,taxable,standard-rate
Glade Oil Diffuser Refill Pineapple & Mangosteen 1 Diffuser Card and 1 Oil Bottle 20ml,,,Home & Lifestyle->Home Supplies->Air Freshners ,,6.99,,,,,,,HLSHSAF034,HLSHSAF034.JPG,,taxable,standard-rate
Air Wick I Motion Scented Oil with Movement Sensor Lavender & Vanilla 21ml,,,Home & Lifestyle->Home Supplies->Air Freshners ,,10.99,,,,,,,HLSHSAF035,HLSHSAF035.JPG,,taxable,standard-rate
Air Wick I Motion Scented Oil Refills Lavender & Chamomile 40ml 2Pk,,,Home & Lifestyle->Home Supplies->Air Freshners ,,9.99,,,,,,,HLSHSAF036,HLSHSAF036.JPG,,taxable,standard-rate
Air Wick I Motion Scented Oil Refills Apple Cinnamon Medley 40ml 2Pk,,,Home & Lifestyle->Home Supplies->Air Freshners ,,9.99,,,,,,,HLSHSAF037,HLSHSAF037.JPG,,taxable,standard-rate
Air Wick I Motion Scented Oil Refills Crisp Breeze 40ml 2Pk,,,Home & Lifestyle->Home Supplies->Air Freshners ,,9.99,,,,,,,HLSHSAF038,HLSHSAF038.JPG,,taxable,standard-rate
Air Wick I Motion Scented Oil Refills Vanilla Passion 40ml 2Pk,,,Home & Lifestyle->Home Supplies->Air Freshners ,,9.99,,,,,,,HLSHSAF039,HLSHSAF039.JPG,,taxable,standard-rate
Air Wick I Motion Scented Oil Refills Country Berries 40ml 2Pk,,,Home & Lifestyle->Home Supplies->Air Freshners ,,9.99,,,,,,,HLSHSAF040,HLSHSAF040.JPG,,taxable,standard-rate
Air Wick I Motion Scented Oil Refills Cool Linen & White Lilac 40ml 2Pk,,,Home & Lifestyle->Home Supplies->Air Freshners ,,9.99,,,,,,,HLSHSAF041,HLSHSAF041.JPG,,taxable,standard-rate
Air Wick I Motion Scented Oil Warmer and Refills Crisp Linen 20ml ,,,Home & Lifestyle->Home Supplies->Air Freshners ,,7.49,,,,,,,HLSHSAF042,HLSHSAF042.JPG,,taxable,standard-rate
Febreze Car Vent Clips Linen & Sky 2ml,,,Home & Lifestyle->Home Supplies->Air Freshners ,,4.29,,,,,,,HLSHSAF043,HLSHSAF043.JPG,,taxable,standard-rate
Febreze Car Vent Clips Hawaiian Aloha 2ml,,,Home & Lifestyle->Home Supplies->Air Freshners ,,4.29,,,,,,,HLSHSAF044,HLSHSAF044.JPG,,taxable,standard-rate
Febreze Car Vent Clips New Car Scent 2ml,,,Home & Lifestyle->Home Supplies->Air Freshners ,,4.29,,,,,,,HLSHSAF045,HLSHSAF045.JPG,,taxable,standard-rate
Glade PlugIns Scented Oil Warmer and Refill Hawaiian Breeze ,,,Home & Lifestyle->Home Supplies->Air Freshners ,,7.99,,,,,,,HLSHSAF046,HLSHSAF046.JPG,,taxable,standard-rate
Air Wick Freshmatic Compact Auto Spray Warmer and Refill Fresh Waters 22.7g,,,Home & Lifestyle->Home Supplies->Air Freshners ,,12.99,,,,,,,HLSHSAF047,HLSHSAF047.JPG,,taxable,standard-rate
Air Wick Freshmatic Compact Auto Spray Warmer and Refill Lavender & Chamomile 22.7g,,,Home & Lifestyle->Home Supplies->Air Freshners ,,12.99,,,,,,,HLSHSAF048,HLSHSAF048.JPG,,taxable,standard-rate
Glade Ultra Concentrated Air Freshener Clean Linen ,,,Home & Lifestyle->Home Supplies->Air Freshners ,,2.29,,,,,,,HLSHSAF049,HLSHSAF049.JPG,,taxable,standard-rate
Glade PlugIns Scented Oil Refills Clean Linen 2Pk,,,Home & Lifestyle->Home Supplies->Air Freshners ,,8.99,,,,,,,HLSHSAF050,HLSHSAF050.JPG,,taxable,standard-rate
Glade PlugIns Scented Oil Refills Hawaiian Breeze and Passion Fruit 2Pk,,,Home & Lifestyle->Home Supplies->Air Freshners ,,8.99,,,,,,,HLSHSAF051,HLSHSAF051.JPG,,taxable,standard-rate
Glade PlugIns Scented Oil Refills French Vanilla 2Pk,,,Home & Lifestyle->Home Supplies->Air Freshners ,,8.99,,,,,,,HLSHSAF052,HLSHSAF052.JPG,,taxable,standard-rate
Glade PlugIns Scented Oil Refills Apple Cinnamon 2Pk,,,Home & Lifestyle->Home Supplies->Air Freshners ,,8.99,,,,,,,HLSHSAF053,HLSHSAF053.JPG,,taxable,standard-rate
Febreze Set & Refresh Kit Linen & Sky 5.5ml,,,Home & Lifestyle->Home Supplies->Air Freshners ,,4.29,,,,,,,HLSHSAF054,HLSHSAF054.JPG,,taxable,standard-rate
Febreze Set & Refresh Kit Spring & Renewal 5.5ml,,,Home & Lifestyle->Home Supplies->Air Freshners ,,4.29,,,,,,,HLSHSAF055,HLSHSAF055.JPG,,taxable,standard-rate
Febreze Set & Refresh Refills Linen & Sky 11ml,,,Home & Lifestyle->Home Supplies->Air Freshners ,,5.99,,,,,,,HLSHSAF056,HLSHSAF056.JPG,,taxable,standard-rate
Febreze Set & Refresh Refills Spring & Renewal 11ml,,,Home & Lifestyle->Home Supplies->Air Freshners ,,5.99,,,,,,,HLSHSAF057,HLSHSAF057.JPG,,taxable,standard-rate
Febreze Set & Refresh Refills Hawaiian Aloha 11ml,,,Home & Lifestyle->Home Supplies->Air Freshners ,,5.99,,,,,,,HLSHSAF058,HLSHSAF058.JPG,,taxable,standard-rate
Febreze Set & Refresh Refills Thai Dragon Fruit 11ml,,,Home & Lifestyle->Home Supplies->Air Freshners ,,5.99,,,,,,,HLSHSAF059,HLSHSAF059.JPG,,taxable,standard-rate
Glade Solid Air Freshener Apple Cinnamon 170g,,,Home & Lifestyle->Home Supplies->Air Freshners ,,1.99,,,,,,,HLSHSAF060,HLSHSAF060.JPG,,taxable,standard-rate
Glade Solid Air Freshener Lean Linen 170g,,,Home & Lifestyle->Home Supplies->Air Freshners ,,1.99,,,,,,,HLSHSAF061,HLSHSAF061.JPG,,taxable,standard-rate
Glade Solid Air Freshener Hawaiian Breeze 170g,,,Home & Lifestyle->Home Supplies->Air Freshners ,,1.99,,,,,,,HLSHSAF062,HLSHSAF062.JPG,,taxable,standard-rate
Febreze Air Effects Hawaiian Aloha 275g,,,Home & Lifestyle->Home Supplies->Air Freshners ,,4.29,,,,,,,HLSHSAF063,HLSHSAF063.JPG,,taxable,standard-rate
Febreze Air Effects Alaskan Springtime 275g,,,Home & Lifestyle->Home Supplies->Air Freshners ,,4.29,,,,,,,HLSHSAF064,HLSHSAF064.JPG,,taxable,standard-rate
Febreze Air Effects Thai Dragon Fruit 275g,,,Home & Lifestyle->Home Supplies->Air Freshners ,,4.29,,,,,,,HLSHSAF065,HLSHSAF065.JPG,,taxable,standard-rate
Febreze Air Effects Sweet Citrus & Zest 275g,,,Home & Lifestyle->Home Supplies->Air Freshners ,,4.29,,,,,,,HLSHSAF066,HLSHSAF066.JPG,,taxable,standard-rate
Febreze Air Effects Meadows & Rain 275g,,,Home & Lifestyle->Home Supplies->Air Freshners ,,4.29,,,,,,,HLSHSAF067,HLSHSAF067.JPG,,taxable,standard-rate
Febreze Air Effects Spring & Renewal 275g,,,Home & Lifestyle->Home Supplies->Air Freshners ,,4.29,,,,,,,HLSHSAF068,HLSHSAF068.JPG,,taxable,standard-rate
Febreze Air Effects Linen & Sky 275g,,,Home & Lifestyle->Home Supplies->Air Freshners ,,4.29,,,,,,,HLSHSAF069,HLSHSAF069.JPG,,taxable,standard-rate
Glade Starter Kit Pineapple & Mangosteen 1 Holder and 1 Refill 198g,,,Home & Lifestyle->Home Supplies->Air Freshners ,,4.99,,,,,,,HLSHSAF070,HLSHSAF070.JPG,,taxable,standard-rate
Glade Starter Kit Holiday Pine & Bayberry 1 Holder and 1 Refill 198g,,,Home & Lifestyle->Home Supplies->Air Freshners ,,4.99,,,,,,,HLSHSAF071,HLSHSAF071.JPG,,taxable,standard-rate
Glade Starter Kit Cotton & Italian Mandarin 1 Holder and 1 Refill 198g,,,Home & Lifestyle->Home Supplies->Air Freshners ,,4.99,,,,,,,HLSHSAF072,HLSHSAF072.JPG,,taxable,standard-rate
Glade Starter Kit Refill Holiday Pine & Bayberry 198g,,,Home & Lifestyle->Home Supplies->Air Freshners ,,4.99,,,,,,,HLSHSAF073,HLSHSAF073.JPG,,taxable,standard-rate
Glade Starter Kit Refill Cotton & Italian Mandarin 198g,,,Home & Lifestyle->Home Supplies->Air Freshners ,,4.99,,,,,,,HLSHSAF074,HLSHSAF074.JPG,,taxable,standard-rate
Glade Starter Kit Refill Fuji Apple & Cardamon Spice 198g,,,Home & Lifestyle->Home Supplies->Air Freshners ,,4.99,,,,,,,HLSHSAF075,HLSHSAF075.JPG,,taxable,standard-rate
Glade Air Freshener Hawaiian Breeze 227g,,,Home & Lifestyle->Home Supplies->Air Freshners ,,1.99,,,,,,,HLSHSAF076,HLSHSAF076.JPG,,taxable,standard-rate
Glade Air Freshener Lavender & Vanilla 227g,,,Home & Lifestyle->Home Supplies->Air Freshners ,,1.99,,,,,,,HLSHSAF077,HLSHSAF077.JPG,,taxable,standard-rate
Glade Air Freshener Clean Linen 227g,,,Home & Lifestyle->Home Supplies->Air Freshners ,,1.99,,,,,,,HLSHSAF078,HLSHSAF078.JPG,,taxable,standard-rate
Air Wick Scented Oil Crisp Linen Value Pack Warmers and Refills 2Pk,,,Home & Lifestyle->Home Supplies->Air Freshners ,,7.49,,,,,,,HLSHSAF079,HLSHSAF079.JPG,,taxable,standard-rate
