title,description,short_description,category,stock,price,regular_price,sales_prices,weight,length,width,height,sku,picture,tags,tax_status,tax_class
L'Oreal Active Hydrafresh Refreshing Gel-Cream SPF-15 Normal to Oily Skin 70ml,,,Home & Lifestyle->Personal Care->Facial Care & Body Lotion,,14.49,,,,,,,HLPCFCBL001,HLPCFCBL001.JPG,,taxable,standard-rate
L'Oreal Wrinkle Defense Moisturizing Cream 50ml,,,Home & Lifestyle->Personal Care->Facial Care & Body Lotion,,18.99,,,,,,,HLPCFCBL002,HLPCFCBL002.JPG,,taxable,standard-rate
L'Oreal Eye Defense Gel Cream 15ml,,,Home & Lifestyle->Personal Care->Facial Care & Body Lotion,,18.99,,,,,,,HLPCFCBL003,HLPCFCBL003.JPG,,taxable,standard-rate
L'Oreal Active Futre-e Moisturizing Cream Dry & Sensitive Skin 50ml,,,Home & Lifestyle->Personal Care->Facial Care & Body Lotion,,13.99,,,,,,,HLPCFCBL004,HLPCFCBL004.JPG,,taxable,standard-rate
L'Oreal Futur-e Moisturizing Lotion SPE-15 Normal to Dry Skin 120ml,,,Home & Lifestyle->Personal Care->Facial Care & Body Lotion,,13.99,,,,,,,HLPCFCBL005,HLPCFCBL005.JPG,,taxable,standard-rate
L'Oreal Revitalift Wet Cleansing Towerlettes,,,Home & Lifestyle->Personal Care->Facial Care & Body Lotion,,10.99,,,,,,,HLPCFCBL006,HLPCFCBL006.JPG,,taxable,standard-rate
L'Oreal Age Perfect Anti-Fatigue Cleansing Lotion Mature Skin 200ml,,,Home & Lifestyle->Personal Care->Facial Care & Body Lotion,,11.99,,,,,,,HLPCFCBL007,HLPCFCBL007.JPG,,taxable,standard-rate
L'Oreal Age Perfect Anti-Fatigue Toner Mature Skin 200ml,,,Home & Lifestyle->Personal Care->Facial Care & Body Lotion,,11.99,,,,,,,HLPCFCBL008,HLPCFCBL008.JPG,,taxable,standard-rate
L'Oreal Go 360 Clean Deep Exfoliating Scrub All Skin 178ml,,,Home & Lifestyle->Personal Care->Facial Care & Body Lotion,,11.99,,,,,,,HLPCFCBL009,HLPCFCBL009.JPG,,taxable,standard-rate
L'Oreal Go 360 Clean Deep Cream Cleanser Normal to Dry Skin 178ml,,,Home & Lifestyle->Personal Care->Facial Care & Body Lotion,,11.99,,,,,,,HLPCFCBL010,HLPCFCBL010.JPG,,taxable,standard-rate
L'Oreal Go 360 Clean Deep Facial Cleanser Combination Skin 178ml,,,Home & Lifestyle->Personal Care->Facial Care & Body Lotion,,11.99,,,,,,,HLPCFCBL011,HLPCFCBL011.JPG,,taxable,standard-rate
L'Oreal Go 360 Clean Deep Facial Cleanser Sensitive Skin 178ml,,,Home & Lifestyle->Personal Care->Facial Care & Body Lotion,,11.99,,,,,,,HLPCFCBL012,HLPCFCBL012.JPG,,taxable,standard-rate
Pond's Dry Skin Cream 180ml,,,Home & Lifestyle->Personal Care->Facial Care & Body Lotion,,7.99,,,,,,,HLPCFCBL013,HLPCFCBL013.JPG,,taxable,standard-rate
Olay Complete All Day Moisture Cream Normal SPF-15 60ml,,,Home & Lifestyle->Personal Care->Facial Care & Body Lotion,,11.99,,,,,,,HLPCFCBL014,HLPCFCBL014.JPG,,taxable,standard-rate
Olay Moisturizing Cream Sensitive Skin 100ml,,,Home & Lifestyle->Personal Care->Facial Care & Body Lotion,,12.99,,,,,,,HLPCFCBL015,HLPCFCBL015.JPG,,taxable,standard-rate
Olay Moisturizing Lotion Sensitive Skin 120ml,,,Home & Lifestyle->Personal Care->Facial Care & Body Lotion,,10.99,,,,,,,HLPCFCBL016,HLPCFCBL016.JPG,,taxable,standard-rate
Olay Age Defying Protective Renewal Lotion 120ml,,,Home & Lifestyle->Personal Care->Facial Care & Body Lotion,,14.99,,,,,,,HLPCFCBL017,HLPCFCBL017.JPG,,taxable,standard-rate
Olay Age Defying Anti-Wrinkle Daily SPF-15 Lotion 100ml,,,Home & Lifestyle->Personal Care->Facial Care & Body Lotion,,16.99,,,,,,,HLPCFCBL018,HLPCFCBL018.JPG,,taxable,standard-rate
Olay Age Defying Anti-Wrinkle Night Cream 60ml,,,Home & Lifestyle->Personal Care->Facial Care & Body Lotion,,16.99,,,,,,,HLPCFCBL019,HLPCFCBL019.JPG,,taxable,standard-rate
Olay Complete SPF-30 Defense All Day Moisturizer Sentive Skin 75ml,,,Home & Lifestyle->Personal Care->Facial Care & Body Lotion,,14.99,,,,,,,HLPCFCBL020,HLPCFCBL020.JPG,,taxable,standard-rate
Olay Complete SPF-15 All Day Moisturizer Combination/Oily 120ml,,,Home & Lifestyle->Personal Care->Facial Care & Body Lotion,,12.99,,,,,,,HLPCFCBL021,HLPCFCBL021.JPG,,taxable,standard-rate
Olay Complete SPF-15 All Day Moisturizer Sensitive Skin 120ml,,,Home & Lifestyle->Personal Care->Facial Care & Body Lotion,,12.99,,,,,,,HLPCFCBL022,HLPCFCBL022.JPG,,taxable,standard-rate
Olay Age Defying Series DailyRenewal Cleanser 200ml,,,Home & Lifestyle->Personal Care->Facial Care & Body Lotion,,8.99,,,,,,,HLPCFCBL023,HLPCFCBL023.JPG,,taxable,standard-rate
Olay Total Effects 7 in One Revitalizing Foaming Cleanser 192ml,,,Home & Lifestyle->Personal Care->Facial Care & Body Lotion,,11.99,,,,,,,HLPCFCBL024,HLPCFCBL024.JPG,,taxable,standard-rate
Olay Regenerist Advanced Anti-Aging Regenerating Cream Cleanser 150ml,,,Home & Lifestyle->Personal Care->Facial Care & Body Lotion,,11.99,,,,,,,HLPCFCBL025,HLPCFCBL025.JPG,,taxable,standard-rate
Jergens Natural Glow Face Visage SPF-20 Fair to Medium Skin 70ml,,,Home & Lifestyle->Personal Care->Facial Care & Body Lotion,,9.99,,,,,,,HLPCFCBL026,HLPCFCBL026.JPG,,taxable,standard-rate
Jergens Natural Glow Daily Facial Moisturizer SPF-20 Fair to Medium Skin 70ml,,,Home & Lifestyle->Personal Care->Facial Care & Body Lotion,,9.99,,,,,,,HLPCFCBL027,HLPCFCBL027.JPG,,taxable,standard-rate
Jergens Natural Glow Daily Moisturizer Revitalizing Fair to Medium 150ml,,,Home & Lifestyle->Personal Care->Facial Care & Body Lotion,,6.99,,,,,,,HLPCFCBL028,HLPCFCBL028.JPG,,taxable,standard-rate
Neutrogena Healthy Defense Daily Moisturizer SPF-45 50ml,,,Home & Lifestyle->Personal Care->Facial Care & Body Lotion,,15.99,,,,,,,HLPCFCBL029,HLPCFCBL029.JPG,,taxable,standard-rate
Neutrogena Healthy Defense Daily Moisturizer SPF-30 50ml,,,Home & Lifestyle->Personal Care->Facial Care & Body Lotion,,14.99,,,,,,,HLPCFCBL030,HLPCFCBL030.JPG,,taxable,standard-rate
Neutrogena Healthy Skin Anti-Wrinkle Cream SPF-15 Original 40ml,,,Home & Lifestyle->Personal Care->Facial Care & Body Lotion,,19.99,,,,,,,HLPCFCBL031,HLPCFCBL031.JPG,,taxable,standard-rate
Neutrogena Healthy Skin Face Lotion SPF-15 70ml,,,Home & Lifestyle->Personal Care->Facial Care & Body Lotion,,11.99,,,,,,,HLPCFCBL032,HLPCFCBL032.JPG,,taxable,standard-rate
Neutrogena Intensified Day Moisture SPF-15 Non-Comdogenic 60ml,,,Home & Lifestyle->Personal Care->Facial Care & Body Lotion,,13.99,,,,,,,HLPCFCBL033,HLPCFCBL033.JPG,,taxable,standard-rate
Neutrogena All-in-One Make-up Removing Cleansing Wipes 25wipes,,,Home & Lifestyle->Personal Care->Facial Care & Body Lotion,,10.99,,,,,,,HLPCFCBL034,HLPCFCBL034.JPG,,taxable,standard-rate
Neutrogena Oil-Free Eye Make-up Remover 162ml,,,Home & Lifestyle->Personal Care->Facial Care & Body Lotion,,9.99,,,,,,,HLPCFCBL035,HLPCFCBL035.JPG,,taxable,standard-rate
Neutrogena All-in-One Make-up Removing Cleansing Lotion 200ml,,,Home & Lifestyle->Personal Care->Facial Care & Body Lotion,,8.99,,,,,,,HLPCFCBL036,HLPCFCBL036.JPG,,taxable,standard-rate
Neutrogena Fresh Foaming Cleanser 200ml,,,Home & Lifestyle->Personal Care->Facial Care & Body Lotion,,9.99,,,,,,,HLPCFCBL037,HLPCFCBL037.JPG,,taxable,standard-rate
Neutrogena Ultra-Gentle Facial Moisturizer Sensitive Skin 120ml,,,Home & Lifestyle->Personal Care->Facial Care & Body Lotion,,14.99,,,,,,,HLPCFCBL038,HLPCFCBL038.JPG,,taxable,standard-rate
Neutrogena Moisturizes Dry Areas and Removes Shine in Oily Areas Combination Skin 118ml,,,Home & Lifestyle->Personal Care->Facial Care & Body Lotion,,13.99,,,,,,,HLPCFCBL039,HLPCFCBL039.JPG,,taxable,standard-rate
Neutrogena Deep Clean Gentle Scrub Exfoliant 125ml,,,Home & Lifestyle->Personal Care->Facial Care & Body Lotion,,7.99,,,,,,,HLPCFCBL040,HLPCFCBL040.JPG,,taxable,standard-rate
Neutrogena Deep Clean Cream Cleanser Oil Free 200ml,,,Home & Lifestyle->Personal Care->Facial Care & Body Lotion,,9.99,,,,,,,HLPCFCBL041,HLPCFCBL041.JPG,,taxable,standard-rate
Neutrogena Wave Deep Clean Foaming Pads Refills 30 pads,,,Home & Lifestyle->Personal Care->Facial Care & Body Lotion,,9.99,,,,,,,HLPCFCBL042,HLPCFCBL042.JPG,,taxable,standard-rate
Neutrogena Wave Vibrating Power-Cleanser,,,Home & Lifestyle->Personal Care->Facial Care & Body Lotion,,14.99,,,,,,,HLPCFCBL043,HLPCFCBL043.JPG,,taxable,standard-rate
Clean & Clear Dual Action Moisturizer Oil Free 118ml,,,Home & Lifestyle->Personal Care->Facial Care & Body Lotion,,7.99,,,,,,,HLPCFCBL044,HLPCFCBL044.JPG,,taxable,standard-rate
Clean & Clear Advantage Blackhead Clearing Oil Free 235ml,,,Home & Lifestyle->Personal Care->Facial Care & Body Lotion,,7.99,,,,,,,HLPCFCBL045,HLPCFCBL045.JPG,,taxable,standard-rate
Clean & Clear Advantage Blackhead Eraser Scrub Oil Free 141g,,,Home & Lifestyle->Personal Care->Facial Care & Body Lotion,,9.99,,,,,,,HLPCFCBL046,HLPCFCBL046.JPG,,taxable,standard-rate
Clean & Clear Daily Pore Cleanser Oil Free 148ml,,,Home & Lifestyle->Personal Care->Facial Care & Body Lotion,,7.29,,,,,,,HLPCFCBL047,HLPCFCBL047.JPG,,taxable,standard-rate
Clean & Clear Deep Action Cream Cleanser Oil Free 192ml,,,Home & Lifestyle->Personal Care->Facial Care & Body Lotion,,7.99,,,,,,,HLPCFCBL048,HLPCFCBL048.JPG,,taxable,standard-rate
Biore Make-Up Removing Towelettes No Oil Residue 30Pk,,,Home & Lifestyle->Personal Care->Facial Care & Body Lotion,,9.99,,,,,,,HLPCFCBL049,HLPCFCBL049.JPG,,taxable,standard-rate
Biore Deep Cleansing Pore Strips Combo 7 Nose Strips and 7 Face Strips ,,,Home & Lifestyle->Personal Care->Facial Care & Body Lotion,,14.99,,,,,,,HLPCFCBL050,HLPCFCBL050.JPG,,taxable,standard-rate
Biore Deep Cleansing Pore Strips Nose Strips 8Pk,,,Home & Lifestyle->Personal Care->Facial Care & Body Lotion,,9.99,,,,,,,HLPCFCBL051,HLPCFCBL051.JPG,,taxable,standard-rate
Biore Pore Unclogging Scrub Deep Cleaning 140g,,,Home & Lifestyle->Personal Care->Facial Care & Body Lotion,,9.99,,,,,,,HLPCFCBL052,HLPCFCBL052.JPG,,taxable,standard-rate
Biore Blemish Fighting Ice Cleanser Complexion Clearing 200ml,,,Home & Lifestyle->Personal Care->Facial Care & Body Lotion,,9.99,,,,,,,HLPCFCBL053,HLPCFCBL053.JPG,,taxable,standard-rate
Biore Steam Activated Cleanser Deep Cleaning 150ml,,,Home & Lifestyle->Personal Care->Facial Care & Body Lotion,,9.99,,,,,,,HLPCFCBL054,HLPCFCBL054.JPG,,taxable,standard-rate
Nivea Q10 Plus Anti-Wrinkle Night Cream 50ml,,,Home & Lifestyle->Personal Care->Facial Care & Body Lotion,,17.99,,,,,,,HLPCFCBL055,HLPCFCBL055.JPG,,taxable,standard-rate
Nivea Q10 Plus Anti-Wrinkle Day Cream 50ml,,,Home & Lifestyle->Personal Care->Facial Care & Body Lotion,,17.99,,,,,,,HLPCFCBL056,HLPCFCBL056.JPG,,taxable,standard-rate
Nivea Anti-Wrinkle Cream All Skin Types 50ml,,,Home & Lifestyle->Personal Care->Facial Care & Body Lotion,,13.99,,,,,,,HLPCFCBL057,HLPCFCBL057.JPG,,taxable,standard-rate
Nivea Rich Moisturizing Day Care Dry to Sensitive Skin 50ml,,,Home & Lifestyle->Personal Care->Facial Care & Body Lotion,,7.99,,,,,,,HLPCFCBL058,HLPCFCBL058.JPG,,taxable,standard-rate
Nivea Soft Refreshingly Soft Moisturizing Cream 75ml,,,Home & Lifestyle->Personal Care->Facial Care & Body Lotion,,5.99,,,,,,,HLPCFCBL059,HLPCFCBL059.JPG,,taxable,standard-rate
Nivea Soft Refreshingly Soft Cream 200ml,,,Home & Lifestyle->Personal Care->Facial Care & Body Lotion,,10.49,,,,,,,HLPCFCBL060,HLPCFCBL060.JPG,,taxable,standard-rate
Nivea Cream 200ml,,,Home & Lifestyle->Personal Care->Facial Care & Body Lotion,,9.99,,,,,,,HLPCFCBL061,HLPCFCBL061.JPG,,taxable,standard-rate
Nivea Waterproof Eye Make-Up Remover 125ml,,,Home & Lifestyle->Personal Care->Facial Care & Body Lotion,,7.99,,,,,,,HLPCFCBL062,HLPCFCBL062.JPG,,taxable,standard-rate
Nivea Gentle Eye Make-Up Remover 125ml,,,Home & Lifestyle->Personal Care->Facial Care & Body Lotion,,7.99,,,,,,,HLPCFCBL063,HLPCFCBL063.JPG,,taxable,standard-rate
Nivea Aqua Effect Gentle Toner Dry to Sensitive Skin 200ml,,,Home & Lifestyle->Personal Care->Facial Care & Body Lotion,,6.49,,,,,,,HLPCFCBL064,HLPCFCBL064.JPG,,taxable,standard-rate
Nivea Gentle Cleansing Cream Dry to Sensitive Skin 150ml,,,Home & Lifestyle->Personal Care->Facial Care & Body Lotion,,7.99,,,,,,,HLPCFCBL065,HLPCFCBL065.JPG,,taxable,standard-rate
Nivea Q10 Plus Anti-Wrinkle Eye Cream 15ml,,,Home & Lifestyle->Personal Care->Facial Care & Body Lotion,,17.99,,,,,,,HLPCFCBL066,HLPCFCBL066.JPG,,taxable,standard-rate
Vaseline Sheer InfusionBotanical Body Lotion 200ml,,,Home & Lifestyle->Personal Care->Facial Care & Body Lotion,,8.49,,,,,,,HLPCFCBL067,HLPCFCBL067.JPG,,taxable,standard-rate
Vaseline Sheer Infusion Mineral Body Lotion 200ml,,,Home & Lifestyle->Personal Care->Facial Care & Body Lotion,,8.49,,,,,,,HLPCFCBL068,HLPCFCBL068.JPG,,taxable,standard-rate
Vaseline Total Moisture Lotion Dry Skin 295ml,,,Home & Lifestyle->Personal Care->Facial Care & Body Lotion,,4.99,,,,,,,HLPCFCBL069,HLPCFCBL069.JPG,,taxable,standard-rate
Vaseline Total Moisture Lotion Aloe Fresh 295ml,,,Home & Lifestyle->Personal Care->Facial Care & Body Lotion,,4.99,,,,,,,HLPCFCBL070,HLPCFCBL070.JPG,,taxable,standard-rate
Vaseline Intensive Rescue Extra Strength Unfragranced 295ml,,,Home & Lifestyle->Personal Care->Facial Care & Body Lotion,,4.99,,,,,,,HLPCFCBL071,HLPCFCBL071.JPG,,taxable,standard-rate
Vaseline Intensive Rescue Extra Strength Chamomile 295ml,,,Home & Lifestyle->Personal Care->Facial Care & Body Lotion,,4.99,,,,,,,HLPCFCBL072,HLPCFCBL072.JPG,,taxable,standard-rate
Vaseline Intensive Rescue Extra Strength Unfragranced 600ml,,,Home & Lifestyle->Personal Care->Facial Care & Body Lotion,,6.79,,,,,,,HLPCFCBL073,HLPCFCBL073.JPG,,taxable,standard-rate
Vaseline Intensive Rescue Extra Strength Chamomile 600ml,,,Home & Lifestyle->Personal Care->Facial Care & Body Lotion,,6.79,,,,,,,HLPCFCBL074,HLPCFCBL074.JPG,,taxable,standard-rate
Vaseline Total Moisture Cocoa Radiant 600ml,,,Home & Lifestyle->Personal Care->Facial Care & Body Lotion,,6.79,,,,,,,HLPCFCBL075,HLPCFCBL075.JPG,,taxable,standard-rate
Vaseline Total Moisture Aloe Fresh 600ml,,,Home & Lifestyle->Personal Care->Facial Care & Body Lotion,,6.79,,,,,,,HLPCFCBL076,HLPCFCBL076.JPG,,taxable,standard-rate
Vaseline Total Moisture Dry Skin 600ml,,,Home & Lifestyle->Personal Care->Facial Care & Body Lotion,,6.79,,,,,,,HLPCFCBL077,HLPCFCBL077.JPG,,taxable,standard-rate
Garnier Ultra-Lift Intense Wrinkles Moisturizing Cream SPF-30 48ml,,,Home & Lifestyle->Personal Care->Facial Care & Body Lotion,,22.99,,,,,,,HLPCFCBL078,HLPCFCBL078.JPG,,taxable,standard-rate
Garnier Ultra-Lift Pro Deep Wrinkles Cream 48ml,,,Home & Lifestyle->Personal Care->Facial Care & Body Lotion,,22.99,,,,,,,HLPCFCBL079,HLPCFCBL079.JPG,,taxable,standard-rate
Garnier Lift Anti-Wrinkle Firming Eye Cream 15ml,,,Home & Lifestyle->Personal Care->Facial Care & Body Lotion,,14.99,,,,,,,HLPCFCBL080,HLPCFCBL080.JPG,,taxable,standard-rate
Garnier Lift Anti-Wrinkle & Firming Moisturizer SPF-20 Daily 50ml,,,Home & Lifestyle->Personal Care->Facial Care & Body Lotion,,14.99,,,,,,,HLPCFCBL081,HLPCFCBL081.JPG,,taxable,standard-rate
Garnier Lift Night Anti-Wrinkle Firming Cream 50ml,,,Home & Lifestyle->Personal Care->Facial Care & Body Lotion,,14.99,,,,,,,HLPCFCBL082,HLPCFCBL082.JPG,,taxable,standard-rate
Garnier Lift Anti-Wrinkle Firming Day Cream 50ml,,,Home & Lifestyle->Personal Care->Facial Care & Body Lotion,,14.99,,,,,,,HLPCFCBL083,HLPCFCBL083.JPG,,taxable,standard-rate
Garnier Fresh Vitamin-enriched Toner 200ml,,,Home & Lifestyle->Personal Care->Facial Care & Body Lotion,,7.99,,,,,,,HLPCFCBL084,HLPCFCBL084.JPG,,taxable,standard-rate
Garnier Fresh Eye Makeup Remover 150ml,,,Home & Lifestyle->Personal Care->Facial Care & Body Lotion,,7.99,,,,,,,HLPCFCBL085,HLPCFCBL085.JPG,,taxable,standard-rate
Garnier Skin Renew Gel-Cleanser 150ml,,,Home & Lifestyle->Personal Care->Facial Care & Body Lotion,,10.99,,,,,,,HLPCFCBL086,HLPCFCBL086.JPG,,taxable,standard-rate
Garnier Brusher Microbead Scrub Combinition Skin 150ml,,,Home & Lifestyle->Personal Care->Facial Care & Body Lotion,,10.99,,,,,,,HLPCFCBL087,HLPCFCBL087.JPG,,taxable,standard-rate
Garnier Skin Renew Radiance Moisture Cream 50ml,,,Home & Lifestyle->Personal Care->Facial Care & Body Lotion,,18.99,,,,,,,HLPCFCBL088,HLPCFCBL088.JPG,,taxable,standard-rate
Garnier Fresh 25 Cleansing Cloths,,,Home & Lifestyle->Personal Care->Facial Care & Body Lotion,,7.99,,,,,,,HLPCFCBL089,HLPCFCBL089.JPG,,taxable,standard-rate
Aveeno Positively Radiant Toner 200ml,,,Home & Lifestyle->Personal Care->Facial Care & Body Lotion,,11.99,,,,,,,HLPCFCBL090,HLPCFCBL090.JPG,,taxable,standard-rate
Aveeno Skin Brightening Daily Scrub 140ml,,,Home & Lifestyle->Personal Care->Facial Care & Body Lotion,,11.99,,,,,,,HLPCFCBL091,HLPCFCBL091.JPG,,taxable,standard-rate
Aveeno Ultra-Calming Moisturizing Cream Cleanser 143ml,,,Home & Lifestyle->Personal Care->Facial Care & Body Lotion,,11.99,,,,,,,HLPCFCBL092,HLPCFCBL092.JPG,,taxable,standard-rate
Aveeno Clear Complexion Cream Cleanser 141g,,,Home & Lifestyle->Personal Care->Facial Care & Body Lotion,,9.99,,,,,,,HLPCFCBL093,HLPCFCBL093.JPG,,taxable,standard-rate
Aveeno Clear Complexion Foaming Cleanser 180ml,,,Home & Lifestyle->Personal Care->Facial Care & Body Lotion,,10.99,,,,,,,HLPCFCBL094,HLPCFCBL094.JPG,,taxable,standard-rate
Aveeno Intense Relief Hand Cream 97ml,,,Home & Lifestyle->Personal Care->Facial Care & Body Lotion,,8.49,,,,,,,HLPCFCBL095,HLPCFCBL095.JPG,,taxable,standard-rate
Aveeno Daily Moisturizing Lotion 71ml,,,Home & Lifestyle->Personal Care->Facial Care & Body Lotion,,3.99,,,,,,,HLPCFCBL096,HLPCFCBL096.JPG,,taxable,standard-rate
Aveeno Daily Moisturizing Lotion 227ml,,,Home & Lifestyle->Personal Care->Facial Care & Body Lotion,,8.49,,,,,,,HLPCFCBL097,HLPCFCBL097.JPG,,taxable,standard-rate
Aveeno Skin Relief Moisturizing Cream 312g,,,Home & Lifestyle->Personal Care->Facial Care & Body Lotion,,12.99,,,,,,,HLPCFCBL098,HLPCFCBL098.JPG,,taxable,standard-rate
Aveeno Skin Relif Moisturizing Lotion 227ml,,,Home & Lifestyle->Personal Care->Facial Care & Body Lotion,,8.49,,,,,,,HLPCFCBL099,HLPCFCBL099.JPG,,taxable,standard-rate
St.Ives Fresh Skin Apricot Scrub Exfoliating 300ml,,,Home & Lifestyle->Personal Care->Facial Care & Body Lotion,,5.99,,,,,,,HLPCFCBL100,HLPCFCBL100.JPG,,taxable,standard-rate
St.Ives Fresh Skin Apricot Scrub Exfoliating 150ml,,,Home & Lifestyle->Personal Care->Facial Care & Body Lotion,,4.29,,,,,,,HLPCFCBL101,HLPCFCBL101.JPG,,taxable,standard-rate
St.Ives Naturally Clear Apricot Scrub Blemish & Blackhead Clearing 150ml,,,Home & Lifestyle->Personal Care->Facial Care & Body Lotion,,4.29,,,,,,,HLPCFCBL102,HLPCFCBL102.JPG,,taxable,standard-rate
Herbacin Kamille Soft Hand Cream with Allantoin 75ml,,,Home & Lifestyle->Personal Care->Facial Care & Body Lotion,,3.99,,,,,,,HLPCFCBL103,HLPCFCBL103.JPG,,taxable,standard-rate
Herbacin Kamille Hand Cream 75ml,,,Home & Lifestyle->Personal Care->Facial Care & Body Lotion,,3.99,,,,,,,HLPCFCBL104,HLPCFCBL104.JPG,,taxable,standard-rate
Herbacin Kamille Hand Cream 250ml,,,Home & Lifestyle->Personal Care->Facial Care & Body Lotion,,7.99,,,,,,,HLPCFCBL105,HLPCFCBL105.JPG,,taxable,standard-rate
Olay Daily Lotion Plus Shimmer with Cocoa Butter 350ml,,,Home & Lifestyle->Personal Care->Facial Care & Body Lotion,,7.99,,,,,,,HLPCFCBL106,HLPCFCBL106.JPG,,taxable,standard-rate
Olay Quench Body Lotion Ultra Moisture 350ml,,,Home & Lifestyle->Personal Care->Facial Care & Body Lotion,,8.99,,,,,,,HLPCFCBL107,HLPCFCBL107.JPG,,taxable,standard-rate
Jergens Ultra Care Extra Dry Skin Moisturizer 480ml,,,Home & Lifestyle->Personal Care->Facial Care & Body Lotion,,6.99,,,,,,,HLPCFCBL108,HLPCFCBL108.JPG,,taxable,standard-rate
Jergens Vitamin E Replenishing Moisturizer 480ml,,,Home & Lifestyle->Personal Care->Facial Care & Body Lotion,,6.99,,,,,,,HLPCFCBL109,HLPCFCBL109.JPG,,taxable,standard-rate
Nivea Body Lotion Happy Time Bamboo-Milk 400ml,,,Home & Lifestyle->Personal Care->Facial Care & Body Lotion,,7.99,,,,,,,HLPCFCBL110,HLPCFCBL110.JPG,,taxable,standard-rate
Nivea Body Lotion Express Hydration Sea Minerals 400ml,,,Home & Lifestyle->Personal Care->Facial Care & Body Lotion,,7.99,,,,,,,HLPCFCBL111,HLPCFCBL111.JPG,,taxable,standard-rate
Nivea Firming Lotion Raffermissante Q10 Plus 400ml,,,Home & Lifestyle->Personal Care->Facial Care & Body Lotion,,13.49,,,,,,,HLPCFCBL112,HLPCFCBL112.JPG,,taxable,standard-rate
Aveeno Daily Moisturizing Lotion with Natural Colloidal Oatmeal 532ml,,,Home & Lifestyle->Personal Care->Facial Care & Body Lotion,,12.99,,,,,,,HLPCFCBL113,HLPCFCBL113.JPG,,taxable,standard-rate
Aveeno Skin Relief Moisturizing Lotion 532ml,,,Home & Lifestyle->Personal Care->Facial Care & Body Lotion,,12.99,,,,,,,HLPCFCBL114,HLPCFCBL114.JPG,,taxable,standard-rate
Compliments Oatmeal Moisturizing Lotion 532ml,,,Home & Lifestyle->Personal Care->Facial Care & Body Lotion,,7.99,,,,,,,HLPCFCBL115,HLPCFCBL115.JPG,,taxable,standard-rate
St.Ives Replenishing Mineral Therapy Body Lotion 600ml,,,Home & Lifestyle->Personal Care->Facial Care & Body Lotion,,12.99,,,,,,,HLPCFCBL116,HLPCFCBL116.JPG,,taxable,standard-rate
St.Ives Skin Renewing Collagen Elastin Body Lotion 600ml,,,Home & Lifestyle->Personal Care->Facial Care & Body Lotion,,5.99,,,,,,,HLPCFCBL117,HLPCFCBL117.JPG,,taxable,standard-rate
St.Ives Naturally Soothing Oatmeal & Shea Butter Body Lotion 600ml,,,Home & Lifestyle->Personal Care->Facial Care & Body Lotion,,5.99,,,,,,,HLPCFCBL118,HLPCFCBL118.JPG,,taxable,standard-rate
St.Ives Naturally Soothing Aloe & Chamomile Body Lotion 600ml,,,Home & Lifestyle->Personal Care->Facial Care & Body Lotion,,5.99,,,,,,,HLPCFCBL119,HLPCFCBL119.JPG,,taxable,standard-rate
St.Ives Deep Restoring 24 Hour Moisture Body Lotion 600ml,,,Home & Lifestyle->Personal Care->Facial Care & Body Lotion,,5.99,,,,,,,HLPCFCBL120,HLPCFCBL120.JPG,,taxable,standard-rate
St.Ives Daily Hydrating Vitamin E Body Lotion 600ml,,,Home & Lifestyle->Personal Care->Facial Care & Body Lotion,,5.99,,,,,,,HLPCFCBL121,HLPCFCBL121.JPG,,taxable,standard-rate
Compliments Lotion Ultra Sport 220ml,,,Home & Lifestyle->Personal Care->Facial Care & Body Lotion,,7.99,,,,,,,HLPCFCBL122,HLPCFCBL122.JPG,,taxable,standard-rate
Compliments Sport Sunscreen Continuous Spray SPF 30 177ml,,,Home & Lifestyle->Personal Care->Facial Care & Body Lotion,,7.99,,,,,,,HLPCFCBL123,HLPCFCBL123.JPG,,taxable,standard-rate
Compliments Sunscreen Lotion SPF 15 237ml,,,Home & Lifestyle->Personal Care->Facial Care & Body Lotion,,7.99,,,,,,,HLPCFCBL124,HLPCFCBL124.JPG,,taxable,standard-rate
Compliments Sunscreen Spray SPF30 177ml,,,Home & Lifestyle->Personal Care->Facial Care & Body Lotion,,7.99,,,,,,,HLPCFCBL125,HLPCFCBL125.JPG,,taxable,standard-rate
Compliments Sunscreen Lotion SPF 30 237ml,,,Home & Lifestyle->Personal Care->Facial Care & Body Lotion,,7.99,,,,,,,HLPCFCBL126,HLPCFCBL126.JPG,,taxable,standard-rate
Compliments Sunscreen Lotion SPF 50 237ml,,,Home & Lifestyle->Personal Care->Facial Care & Body Lotion,,7.99,,,,,,,HLPCFCBL127,HLPCFCBL127.JPG,,taxable,standard-rate
Compliments Kids Sunscreen Spray SPF 50 177ml,,,Home & Lifestyle->Personal Care->Facial Care & Body Lotion,,7.99,,,,,,,HLPCFCBL128,HLPCFCBL128.JPG,,taxable,standard-rate
Compliments Aloe Vera Gel 480ml,,,Home & Lifestyle->Personal Care->Facial Care & Body Lotion,,5.99,,,,,,,HLPCFCBL129,HLPCFCBL129.JPG,,taxable,standard-rate
Compliments Kids Sunscreen Lotion 237ml,,,Home & Lifestyle->Personal Care->Facial Care & Body Lotion,,7.99,,,,,,,HLPCFCBL130,HLPCFCBL130.JPG,,taxable,standard-rate
Compliments Nail Polish Remover Lightly Scented 300ml,,,Home & Lifestyle->Personal Care->Facial Care & Body Lotion,,2.49,,,,,,,HLPCFCBL131,HLPCFCBL131.JPG,,taxable,standard-rate
Compliments Nail Polish Remover Lemon Scented 300ml,,,Home & Lifestyle->Personal Care->Facial Care & Body Lotion,,2.49,,,,,,,HLPCFCBL132,HLPCFCBL132.JPG,,taxable,standard-rate
