title,description,short_description,category,stock,price,regular_price,sales_prices,weight,length,width,height,sku,picture,tags,tax_status,tax_class
Method Sea Minerals Hand Wash 354ml,,,Home & Lifestyle->Personal Care->Hand Wash,,4.49,,,,,,,HLPCHW001,HLPCHW001.JPG,,taxable,standard-rate
Method Sweet Water Hand Wash 354ml,,,Home & Lifestyle->Personal Care->Hand Wash,,4.49,,,,,,,HLPCHW002,HLPCHW002.JPG,,taxable,standard-rate
Method Green Tea + Aloe Hand Wash 354ml,,,Home & Lifestyle->Personal Care->Hand Wash,,4.49,,,,,,,HLPCHW003,HLPCHW003.JPG,,taxable,standard-rate
Lysol No-Touch Hydrating Cucumber Splash Refill Hand Soap 251ml,,,Home & Lifestyle->Personal Care->Hand Wash,,4.99,,,,,,,HLPCHW004,HLPCHW004.JPG,,taxable,standard-rate
Lysol No-Touch Vanilla & Brown Sugar Refill Hand Soap 251ml,,,Home & Lifestyle->Personal Care->Hand Wash,,4.99,,,,,,,HLPCHW005,HLPCHW005.JPG,,taxable,standard-rate
Lysol No-Touch Refreshing Essence Refill Hand Soap 251ml,,,Home & Lifestyle->Personal Care->Hand Wash,,4.99,,,,,,,HLPCHW006,HLPCHW006.JPG,,taxable,standard-rate
Lysol No-Touch Moistrurizing Aloe Vera & Vitamin E Refill Hand Soap 251ml,,,Home & Lifestyle->Personal Care->Hand Wash,,4.99,,,,,,,HLPCHW007,HLPCHW007.JPG,,taxable,standard-rate
Lysol No-Touch Refreshing Aloe Vera Hand Soap System,,,Home & Lifestyle->Personal Care->Hand Wash,,14.99,,,,,,,HLPCHW008,HLPCHW008.JPG,,taxable,standard-rate
Lysol No-Touch Soothing Cucumber Hand Soap System,,,Home & Lifestyle->Personal Care->Hand Wash,,14.99,,,,,,,HLPCHW009,HLPCHW009.JPG,,taxable,standard-rate
Compliments Hand Sanitizer Gel 236ml,,,Home & Lifestyle->Personal Care->Hand Wash,,3.49,,,,,,,HLPCHW010,HLPCHW010.JPG,,taxable,standard-rate
One Step Hand Sanitizer with Aloe 473ml,,,Home & Lifestyle->Personal Care->Hand Wash,,6.99,,,,,,,HLPCHW011,HLPCHW011.JPG,,taxable,standard-rate
Wet Ones Hand & Face Wipes Gently Cleans Skin 40wipes,,,Home & Lifestyle->Personal Care->Hand Wash,,3.99,,,,,,,HLPCHW012,HLPCHW012.JPG,,taxable,standard-rate
Wet Ones Hand & Face Wipes Kills Germs 40wipes,,,Home & Lifestyle->Personal Care->Hand Wash,,3.99,,,,,,,HLPCHW013,HLPCHW013.JPG,,taxable,standard-rate
Method Sea Minerals Hand Wash 300ml,,,Home & Lifestyle->Personal Care->Hand Wash,,4.49,,,,,,,HLPCHW014,HLPCHW014.JPG,,taxable,standard-rate
Method Sweer Water Hand Wash 300ml,,,Home & Lifestyle->Personal Care->Hand Wash,,4.49,,,,,,,HLPCHW015,HLPCHW015.JPG,,taxable,standard-rate
Dial Complete Fresh Pear Hand Wash 221ml,,,Home & Lifestyle->Personal Care->Hand Wash,,3.49,,,,,,,HLPCHW016,HLPCHW016.JPG,,taxable,standard-rate
Dial Complete Hello Kitty Hand Wash 221ml,,,Home & Lifestyle->Personal Care->Hand Wash,,3.79,,,,,,,HLPCHW017,HLPCHW017.JPG,,taxable,standard-rate
Softsoap Energizing Pomegranate & Mango Hand Soap 250ml,,,Home & Lifestyle->Personal Care->Hand Wash,,3.99,,,,,,,HLPCHW018,HLPCHW018.JPG,,taxable,standard-rate
Softsoap Moisturizing Shea Butter Hand Soap 250ml,,,Home & Lifestyle->Personal Care->Hand Wash,,3.99,,,,,,,HLPCHW019,HLPCHW019.JPG,,taxable,standard-rate
Softsoap Vanilla & Brown Sugar Hand Soap 225ml,,,Home & Lifestyle->Personal Care->Hand Wash,,2.79,,,,,,,HLPCHW020,HLPCHW020.JPG,,taxable,standard-rate
Softsoap Softening Black Orchid Hand Soap 250ml,,,Home & Lifestyle->Personal Care->Hand Wash,,3.99,,,,,,,HLPCHW021,HLPCHW021.JPG,,taxable,standard-rate
Compliments Aloe Vera Hand Soap 240ml,,,Home & Lifestyle->Personal Care->Hand Wash,,2.49,,,,,,,HLPCHW022,HLPCHW022.JPG,,taxable,standard-rate
Compliments Antibacterial Hand Soap 240ml,,,Home & Lifestyle->Personal Care->Hand Wash,,2.49,,,,,,,HLPCHW023,HLPCHW023.JPG,,taxable,standard-rate
Compliments Cucumber Melon Antibacterial Hand Soap 222ml,,,Home & Lifestyle->Personal Care->Hand Wash,,3.49,,,,,,,HLPCHW024,HLPCHW024.JPG,,taxable,standard-rate
Compliments Mandarin Orange Antibacterial Hand Soap 222ml,,,Home & Lifestyle->Personal Care->Hand Wash,,3.49,,,,,,,HLPCHW025,HLPCHW025.JPG,,taxable,standard-rate
Compliments Lemongrass Antibacterial Hand Soap 222ml,,,Home & Lifestyle->Personal Care->Hand Wash,,3.49,,,,,,,HLPCHW026,HLPCHW026.JPG,,taxable,standard-rate
Softsoap Moisturizing Shea Butter Hand Soap Refill 590ml,,,Home & Lifestyle->Personal Care->Hand Wash,,3.99,,,,,,,HLPCHW027,HLPCHW027.JPG,,taxable,standard-rate
Softsoap Juicy Melon & Crisp Cucumber Hand Soap 225ml,,,Home & Lifestyle->Personal Care->Hand Wash,,2.79,,,,,,,HLPCHW028,HLPCHW028.JPG,,taxable,standard-rate
Softsoap Soothing Aloe Vera Hand Soap 225ml,,,Home & Lifestyle->Personal Care->Hand Wash,,2.79,,,,,,,HLPCHW029,HLPCHW029.JPG,,taxable,standard-rate
Softsoap Aquarium Hand Soap 225ml,,,Home & Lifestyle->Personal Care->Hand Wash,,2.79,,,,,,,HLPCHW030,HLPCHW030.JPG,,taxable,standard-rate
Softsoap Vanilla & Brown Sugar Hand Soap Refill 828ml,,,Home & Lifestyle->Personal Care->Hand Wash,,3.79,,,,,,,HLPCHW031,HLPCHW031.JPG,,taxable,standard-rate
Softsoap Juicy Melon & Crisp Cucumber Hand Soap Refill 828ml,,,Home & Lifestyle->Personal Care->Hand Wash,,3.79,,,,,,,HLPCHW032,HLPCHW032.JPG,,taxable,standard-rate
Softsoap Soothing Aloe Vera Hand Soap Refill 828ml,,,Home & Lifestyle->Personal Care->Hand Wash,,3.79,,,,,,,HLPCHW033,HLPCHW033.JPG,,taxable,standard-rate
Softsoap Aquarium Hand Soap Refill 828ml,,,Home & Lifestyle->Personal Care->Hand Wash,,3.79,,,,,,,HLPCHW034,HLPCHW034.JPG,,taxable,standard-rate
Jergens Pure & Gentle Clear Soap 2L,,,Home & Lifestyle->Personal Care->Hand Wash,,6.99,,,,,,,HLPCHW035,HLPCHW035.JPG,,taxable,standard-rate
Dial Eco-Smart Refill Spring Water Hand Soap 1.18L,,,Home & Lifestyle->Personal Care->Hand Wash,,5.49,,,,,,,HLPCHW036,HLPCHW036.JPG,,taxable,standard-rate
Dial Eco-Smart Refill Pomegranate & Tangerine Hand Soap 1.18L,,,Home & Lifestyle->Personal Care->Hand Wash,,5.49,,,,,,,HLPCHW037,HLPCHW037.JPG,,taxable,standard-rate
Compliments Aloe Hand Soap Refill 1.65L,,,Home & Lifestyle->Personal Care->Hand Wash,,4.99,,,,,,,HLPCHW038,HLPCHW038.JPG,,taxable,standard-rate
Softsoap Soothing Aloe Vera Hand Soap Refill 1.45L,,,Home & Lifestyle->Personal Care->Hand Wash,,7.99,,,,,,,HLPCHW039,HLPCHW039.JPG,,taxable,standard-rate
Softsoap Aquarium Hand Soap Refill 1.65L,,,Home & Lifestyle->Personal Care->Hand Wash,,7.99,,,,,,,HLPCHW040,HLPCHW040.JPG,,taxable,standard-rate
Disney Cars Bubble Bath 700ml,,,Home & Lifestyle->Personal Care->Hand Wash,,3.99,,,,,,,HLPCHW041,HLPCHW041.JPG,,taxable,standard-rate
Disney Princess Bubble Bath 700ml,,,Home & Lifestyle->Personal Care->Hand Wash,,3.99,,,,,,,HLPCHW042,HLPCHW042.JPG,,taxable,standard-rate
Dora Bubble Bath 700ml,,,Home & Lifestyle->Personal Care->Hand Wash,,3.99,,,,,,,HLPCHW043,HLPCHW043.JPG,,taxable,standard-rate