title,description,short_description,category,stock,price,regular_price,sales_prices,weight,length,width,height,sku,picture,tags,tax_status,tax_class
Secret Solid Baby Powder Antiperspirant 75g,,,Home & Lifestyle->Personal Care->Antiperspirant & Deodorant,,3.79,,,,,,,HLPCAD001,HLPCAD001.JPG,,taxable,standard-rate
Secret Solid PH Balanced Baby Powder Antiperspirant 73g,,,Home & Lifestyle->Personal Care->Antiperspirant & Deodorant,,3.79,,,,,,,HLPCAD002,HLPCAD002.JPG,,taxable,standard-rate
Secret Aerosol Baby Powder Antiperspirant 175ml,,,Home & Lifestyle->Personal Care->Antiperspirant & Deodorant,,3.79,,,,,,,HLPCAD003,HLPCAD003.JPG,,taxable,standard-rate
Secret Clinical Waterproof All-Day Fresh Scent Power Solid 45g,,,Home & Lifestyle->Personal Care->Antiperspirant & Deodorant,,9.49,,,,,,,HLPCAD004,HLPCAD004.JPG,,taxable,standard-rate
Secret Clinical Ooh-La-La Lavender Scent Power Solid 45g,,,Home & Lifestyle->Personal Care->Antiperspirant & Deodorant,,8.49,,,,,,,HLPCAD005,HLPCAD005.JPG,,taxable,standard-rate
Secret Outlast Unscented Antiperspirant 48g,,,Home & Lifestyle->Personal Care->Antiperspirant & Deodorant,,3.79,,,,,,,HLPCAD006,HLPCAD006.JPG,,taxable,standard-rate
Secret Outlast Protecting Powder Antiperspirant 48g,,,Home & Lifestyle->Personal Care->Antiperspirant & Deodorant,,3.79,,,,,,,HLPCAD007,HLPCAD007.JPG,,taxable,standard-rate
Secret Fresh Effects Orange Blossom Verbena Scent Antiperspirant 45g,,,Home & Lifestyle->Personal Care->Antiperspirant & Deodorant,,3.79,,,,,,,HLPCAD008,HLPCAD008.JPG,,taxable,standard-rate
Secret Scent Expressions Va Va Vanilla Scent Antiperspirant 48g,,,Home & Lifestyle->Personal Care->Antiperspirant & Deodorant,,3.79,,,,,,,HLPCAD009,HLPCAD009.JPG,,taxable,standard-rate
Secret Scent Expressions ooh-la-la Lavender Scent Antiperspirant 48g,,,Home & Lifestyle->Personal Care->Antiperspirant & Deodorant,,3.79,,,,,,,HLPCAD010,HLPCAD010.JPG,,taxable,standard-rate
Secret Body Spray Scent Expressions Cocoa Butter Kiss Scent 29.6ml,,,Home & Lifestyle->Personal Care->Antiperspirant & Deodorant,,1.99,,,,,,,HLPCAD011,HLPCAD011.JPG,,taxable,standard-rate
Secret Body Spray Scent Expressions ooh-la-la Lavender Scent 89ml,,,Home & Lifestyle->Personal Care->Antiperspirant & Deodorant,,4.29,,,,,,,HLPCAD012,HLPCAD012.JPG,,taxable,standard-rate
Secret Body Spray Scent Expressions Cocoa Butter Kiss Scent 89ml,,,Home & Lifestyle->Personal Care->Antiperspirant & Deodorant,,4.29,,,,,,,HLPCAD013,HLPCAD013.JPG,,taxable,standard-rate
Secret Invisible pH Balanced Unscented Antiperspirant 45g,,,Home & Lifestyle->Personal Care->Antiperspirant & Deodorant,,3.79,,,,,,,HLPCAD014,HLPCAD014.JPG,,taxable,standard-rate
Secret Invisible pH Balanced Baby Powder Antiperspirant 45g,,,Home & Lifestyle->Personal Care->Antiperspirant & Deodorant,,3.79,,,,,,,HLPCAD015,HLPCAD015.JPG,,taxable,standard-rate
Secret Invisible pH Balanced Spring Breeze Antiperspirant 45g,,,Home & Lifestyle->Personal Care->Antiperspirant & Deodorant,,3.79,,,,,,,HLPCAD016,HLPCAD016.JPG,,taxable,standard-rate
Secret Smooth Solid Outlast & OLAY Protecting Powder Antiperspirant 45g,,,Home & Lifestyle->Personal Care->Antiperspirant & Deodorant,,3.79,,,,,,,HLPCAD017,HLPCAD017.JPG,,taxable,standard-rate
Secret Invisible Scent Expressions Va Va Vanilla Scent Antiperspirant 45g,,,Home & Lifestyle->Personal Care->Antiperspirant & Deodorant,,3.79,,,,,,,HLPCAD018,HLPCAD018.JPG,,taxable,standard-rate
Dove Clinical Protection Cool Essentials Cucumber & Green Tea Scent Antiperspirant Solid 45g,,,Home & Lifestyle->Personal Care->Antiperspirant & Deodorant,,8.99,,,,,,,HLPCAD019,HLPCAD019.JPG,,taxable,standard-rate
Dove Clinical Protection Original Clean Light Scent Antiperspirant Solid 45g,,,Home & Lifestyle->Personal Care->Antiperspirant & Deodorant,,8.99,,,,,,,HLPCAD020,HLPCAD020.JPG,,taxable,standard-rate
Dove Ultimate BeautyCare Original with Moisturizers Antiperspirant 45g,,,Home & Lifestyle->Personal Care->Antiperspirant & Deodorant,,5.49,,,,,,,HLPCAD021,HLPCAD021.JPG,,taxable,standard-rate
Dove VisiblySmooth Wild Rose Scent Antiperspirant 45g,,,Home & Lifestyle->Personal Care->Antiperspirant & Deodorant,,5.49,,,,,,,HLPCAD022,HLPCAD022.JPG,,taxable,standard-rate
Dove GoSleeveless Original Antiperspirant 45g,,,Home & Lifestyle->Personal Care->Antiperspirant & Deodorant,,5.49,,,,,,,HLPCAD023,HLPCAD023.JPG,,taxable,standard-rate
Dove GoSleeveless Beauty Fresh Antiperspirant 45g,,,Home & Lifestyle->Personal Care->Antiperspirant & Deodorant,,5.49,,,,,,,HLPCAD024,HLPCAD024.JPG,,taxable,standard-rate
Dove ClearTone Skin Renew antiperspirant 45g,,,Home & Lifestyle->Personal Care->Antiperspirant & Deodorant,,5.49,,,,,,,HLPCAD025,HLPCAD025.JPG,,taxable,standard-rate
Dove Go Fresh Body Mist Energzing Grapefruit & Lemongrass Scent 89ml,,,Home & Lifestyle->Personal Care->Antiperspirant & Deodorant,,5.49,,,,,,,HLPCAD026,HLPCAD026.JPG,,taxable,standard-rate
Dove Go Fresh Body Mist Rebalance Plum & Sakura Blossom Scent 89ml,,,Home & Lifestyle->Personal Care->Antiperspirant & Deodorant,,5.49,,,,,,,HLPCAD027,HLPCAD027.JPG,,taxable,standard-rate
Dove Go Fresh Body Mist Cool Essentials Cucumber & Green Tea Scent 89ml,,,Home & Lifestyle->Personal Care->Antiperspirant & Deodorant,,5.49,,,,,,,HLPCAD028,HLPCAD028.JPG,,taxable,standard-rate
Dove Go Fresh Body Mist Revive Pomegranate & Lemon Verbena Scent 89ml,,,Home & Lifestyle->Personal Care->Antiperspirant & Deodorant,,5.49,,,,,,,HLPCAD029,HLPCAD029.JPG,,taxable,standard-rate
Dove Go Fresh Solid Antiperspirant Energzing Grapefruit & Lemongrass Scent 45g,,,Home & Lifestyle->Personal Care->Antiperspirant & Deodorant,,5.49,,,,,,,HLPCAD030,HLPCAD030.JPG,,taxable,standard-rate
Dove Go Fresh Solid Antiperspirant Rebalance Plum & Sakura Blossom Scent 45g,,,Home & Lifestyle->Personal Care->Antiperspirant & Deodorant,,5.49,,,,,,,HLPCAD031,HLPCAD031.JPG,,taxable,standard-rate
Dove Go Fresh Solid Antiperspirant Cool Essentials Cucumber & Green Tea Scent 45g,,,Home & Lifestyle->Personal Care->Antiperspirant & Deodorant,,5.49,,,,,,,HLPCAD032,HLPCAD032.JPG,,taxable,standard-rate
Dove Go Fresh Solid Antiperspirant Revive Pomegranate & Lemon Verbena Scent 89ml,,,Home & Lifestyle->Personal Care->Antiperspirant & Deodorant,,5.49,,,,,,,HLPCAD033,HLPCAD033.JPG,,taxable,standard-rate
Dove Fresh Invisible Solid Antiperspirant with Moisturizers 74g,,,Home & Lifestyle->Personal Care->Antiperspirant & Deodorant,,5.49,,,,,,,HLPCAD034,HLPCAD034.JPG,,taxable,standard-rate
Dove Powder Invisible Solid Antiperspirant with Moisturizers 74g,,,Home & Lifestyle->Personal Care->Antiperspirant & Deodorant,,5.49,,,,,,,HLPCAD035,HLPCAD035.JPG,,taxable,standard-rate
Dove Cool Essentials Cucumber & Green Tea Scent Invisible Solid Antiperspirant 74g,,,Home & Lifestyle->Personal Care->Antiperspirant & Deodorant,,5.49,,,,,,,HLPCAD036,HLPCAD036.JPG,,taxable,standard-rate
Nivea Double Effect Protection and Smooth Underarm Feeling Antiperspirant 43g,,,Home & Lifestyle->Personal Care->Antiperspirant & Deodorant,,3.99,,,,,,,HLPCAD037,HLPCAD037.JPG,,taxable,standard-rate
Nivea Calm & Care Invisible Solid Antiperspirant 43g,,,Home & Lifestyle->Personal Care->Antiperspirant & Deodorant,,3.99,,,,,,,HLPCAD038,HLPCAD038.JPG,,taxable,standard-rate
Nivea Happy Time Shower Freshness All Day Long with Bamboo Extracts Antiperspirant 43g,,,Home & Lifestyle->Personal Care->Antiperspirant & Deodorant,,3.99,,,,,,,HLPCAD039,HLPCAD039.JPG,,taxable,standard-rate
Nivea Dry Confidence Regulation of Perspiration Invisible Solid Antiperspirant 43g,,,Home & Lifestyle->Personal Care->Antiperspirant & Deodorant,,3.99,,,,,,,HLPCAD040,HLPCAD040.JPG,,taxable,standard-rate
Nivea Pearl & Beauty Beautiful Skin with Pearl Extracts Invisible Solid Antiperspirant 43g,,,Home & Lifestyle->Personal Care->Antiperspirant & Deodorant,,3.99,,,,,,,HLPCAD041,HLPCAD041.JPG,,taxable,standard-rate
Nivea White Invisible for Black & White Mark Contol & Anti-Yellow Staining Antiperspirant 43g,,,Home & Lifestyle->Personal Care->Antiperspirant & Deodorant,,3.99,,,,,,,HLPCAD042,HLPCAD042.JPG,,taxable,standard-rate
Lady Speed Stick Fresh Infusion Strawberry Splash Scent Antiperspirant 45g,,,Home & Lifestyle->Personal Care->Antiperspirant & Deodorant,,3.79,,,,,,,HLPCAD043,HLPCAD043.JPG,,taxable,standard-rate
Lady Speed Stick Fresh Infusion Raspberry Burst Scent Antiperspirant 45g,,,Home & Lifestyle->Personal Care->Antiperspirant & Deodorant,,3.79,,,,,,,HLPCAD044,HLPCAD044.JPG,,taxable,standard-rate
Lady Speed Stick Powder Fresh Invisible Antiperspirant 70g,,,Home & Lifestyle->Personal Care->Antiperspirant & Deodorant,,3.79,,,,,,,HLPCAD045,HLPCAD045.JPG,,taxable,standard-rate
Lady Speed Stick Unscented Invisible Antiperspirant 70g,,,Home & Lifestyle->Personal Care->Antiperspirant & Deodorant,,3.79,,,,,,,HLPCAD046,HLPCAD046.JPG,,taxable,standard-rate
Lady Speed Stick Stainguard Daringly Fresh Antiperspirant 65g,,,Home & Lifestyle->Personal Care->Antiperspirant & Deodorant,,3.79,,,,,,,HLPCAD047,HLPCAD047.JPG,,taxable,standard-rate
Lady Speed Stick Fresh Infusion Fruity Melon Antiperspirant 45g,,,Home & Lifestyle->Personal Care->Antiperspirant & Deodorant,,3.79,,,,,,,HLPCAD048,HLPCAD048.JPG,,taxable,standard-rate
Lady Speed Stick Fresh Infusion Tropical Breeze Antiperspirant 45g,,,Home & Lifestyle->Personal Care->Antiperspirant & Deodorant,,3.79,,,,,,,HLPCAD049,HLPCAD049.JPG,,taxable,standard-rate
Lady Speed Stick Powder Fresh Invisible Antiperspirant 45g,,,Home & Lifestyle->Personal Care->Antiperspirant & Deodorant,,3.79,,,,,,,HLPCAD050,HLPCAD050.JPG,,taxable,standard-rate
lady Speed Stick Stainguard Radiantly Fresh Antiperspirant 65g,,,Home & Lifestyle->Personal Care->Antiperspirant & Deodorant,,5.79,,,,,,,HLPCAD051,HLPCAD051.JPG,,taxable,standard-rate
Degree Clinical Motion Sense Shower Clean Antiperspirant 48g,,,Home & Lifestyle->Personal Care->Antiperspirant & Deodorant,,8.99,,,,,,,HLPCAD052,HLPCAD052.JPG,,taxable,standard-rate
Degree Clinical Motion Sense Cotton Fresh Antiperspirant 48g,,,Home & Lifestyle->Personal Care->Antiperspirant & Deodorant,,8.99,,,,,,,HLPCAD053,HLPCAD053.JPG,,taxable,standard-rate
Degree Motion Sense Cotton Fresh Antiperspirant 48g,,,Home & Lifestyle->Personal Care->Antiperspirant & Deodorant,,3.79,,,,,,,HLPCAD054,HLPCAD054.JPG,,taxable,standard-rate
Degree Ultra Clear Pure Powder Invisible Antiperspirant 48g,,,Home & Lifestyle->Personal Care->Antiperspirant & Deodorant,,3.79,,,,,,,HLPCAD055,HLPCAD055.JPG,,taxable,standard-rate
Degree Ultra Clear Pure Rain Invisible Antiperspirant 48g,,,Home & Lifestyle->Personal Care->Antiperspirant & Deodorant,,3.79,,,,,,,HLPCAD056,HLPCAD056.JPG,,taxable,standard-rate
Degree Sheer Powder Invisible Antiperspirant 74g,,,Home & Lifestyle->Personal Care->Antiperspirant & Deodorant,,3.79,,,,,,,HLPCAD057,HLPCAD057.JPG,,taxable,standard-rate
Degree Natureffects with Sea Salt Minerals Antiperspirant 48g,,,Home & Lifestyle->Personal Care->Antiperspirant & Deodorant,,3.79,,,,,,,HLPCAD058,HLPCAD058.JPG,,taxable,standard-rate
Degree Natureffects HoneySuckle + Tea Tree Oil Antiperspirant 48g,,,Home & Lifestyle->Personal Care->Antiperspirant & Deodorant,,3.79,,,,,,,HLPCAD059,HLPCAD059.JPG,,taxable,standard-rate
Degree Motion Sense Active Clean Antiperspirant 48g,,,Home & Lifestyle->Personal Care->Antiperspirant & Deodorant,,3.79,,,,,,,HLPCAD060,HLPCAD060.JPG,,taxable,standard-rate
Degree Motion Sense Fresh Energy Antiperspirant 48g,,,Home & Lifestyle->Personal Care->Antiperspirant & Deodorant,,3.79,,,,,,,HLPCAD061,HLPCAD061.JPG,,taxable,standard-rate
AXE Cool Metal Deodorant Bodyspray 113g,,,Home & Lifestyle->Personal Care->Antiperspirant & Deodorant,,5.49,,,,,,,HLPCAD062,HLPCAD062.JPG,,taxable,standard-rate
AXE VICE Deodorant Bodyspray 113g,,,Home & Lifestyle->Personal Care->Antiperspirant & Deodorant,,5.49,,,,,,,HLPCAD063,HLPCAD063.JPG,,taxable,standard-rate
AXE Excited Deodorant Bodyspray 113g,,,Home & Lifestyle->Personal Care->Antiperspirant & Deodorant,,5.49,,,,,,,HLPCAD064,HLPCAD064.JPG,,taxable,standard-rate
AXE Dark Temptation Deodorant Bodayspray 113g,,,Home & Lifestyle->Personal Care->Antiperspirant & Deodorant,,5.49,,,,,,,HLPCAD065,HLPCAD065.JPG,,taxable,standard-rate
AXE Shock Deodorant Bodyspray 113g,,,Home & Lifestyle->Personal Care->Antiperspirant & Deodorant,,5.49,,,,,,,HLPCAD066,HLPCAD066.JPG,,taxable,standard-rate
AXE Twist Deodorant Bodyspray 113g,,,Home & Lifestyle->Personal Care->Antiperspirant & Deodorant,,5.49,,,,,,,HLPCAD067,HLPCAD067.JPG,,taxable,standard-rate
AXE Kilo Deodorant Bodyspray 113g,,,Home & Lifestyle->Personal Care->Antiperspirant & Deodorant,,5.49,,,,,,,HLPCAD068,HLPCAD068.JPG,,taxable,standard-rate
AXE Anarchy Deodorant Bodyspray 113g,,,Home & Lifestyle->Personal Care->Antiperspirant & Deodorant,,5.49,,,,,,,HLPCAD069,HLPCAD069.JPG,,taxable,standard-rate
AXE Fresh Anarchy Deodorant Stick 85g,,,Home & Lifestyle->Personal Care->Antiperspirant & Deodorant,,5.49,,,,,,,HLPCAD070,HLPCAD070.JPG,,taxable,standard-rate
AXE Dry Anarchy Invisible Solid Antiperspirant 76g,,,Home & Lifestyle->Personal Care->Antiperspirant & Deodorant,,5.49,,,,,,,HLPCAD071,HLPCAD071.JPG,,taxable,standard-rate
AXE Fresh Dark Temptation Deodorant Stick 85g,,,Home & Lifestyle->Personal Care->Antiperspirant & Deodorant,,5.49,,,,,,,HLPCAD072,HLPCAD072.JPG,,taxable,standard-rate
AXE Dry Dark Temptation Invisible Solid Antiperspirant 76g,,,Home & Lifestyle->Personal Care->Antiperspirant & Deodorant,,5.49,,,,,,,HLPCAD073,HLPCAD073.JPG,,taxable,standard-rate
AXE Dry Essence Invisible Solid Antiperspirant 76g,,,Home & Lifestyle->Personal Care->Antiperspirant & Deodorant,,5.49,,,,,,,HLPCAD074,HLPCAD074.JPG,,taxable,standard-rate
AXE Dry Kilo Invisible Solid Antiperspirant 76g,,,Home & Lifestyle->Personal Care->Antiperspirant & Deodorant,,5.49,,,,,,,HLPCAD075,HLPCAD075.JPG,,taxable,standard-rate
AXE Fresh Twist Deodorant Stick 85g,,,Home & Lifestyle->Personal Care->Antiperspirant & Deodorant,,5.49,,,,,,,HLPCAD076,HLPCAD076.JPG,,taxable,standard-rate
AXE Dry Twist Invisible Solid Antiperspirant 76g,,,Home & Lifestyle->Personal Care->Antiperspirant & Deodorant,,5.49,,,,,,,HLPCAD077,HLPCAD077.JPG,,taxable,standard-rate
AXE Fresh Phoenix Deodorant Stick 85g,,,Home & Lifestyle->Personal Care->Antiperspirant & Deodorant,,5.49,,,,,,,HLPCAD078,HLPCAD078.JPG,,taxable,standard-rate
AXE Dry Phoenix Invisible Solid Antiperspirant 76g,,,Home & Lifestyle->Personal Care->Antiperspirant & Deodorant,,5.49,,,,,,,HLPCAD079,HLPCAD079.JPG,,taxable,standard-rate
AXE Dry Excite Invisible Solid Antiperspirant 76g,,,Home & Lifestyle->Personal Care->Antiperspirant & Deodorant,,5.49,,,,,,,HLPCAD080,HLPCAD080.JPG,,taxable,standard-rate
Old Spice After Hour Body Spray 154ml,,,Home & Lifestyle->Personal Care->Antiperspirant & Deodorant,,4.99,,,,,,,HLPCAD081,HLPCAD081.JPG,,taxable,standard-rate
Old Spice Pure Sport Body Spray 154ml,,,Home & Lifestyle->Personal Care->Antiperspirant & Deodorant,,4.99,,,,,,,HLPCAD082,HLPCAD082.JPG,,taxable,standard-rate
Old Spice After Hour Deodorant 85g,,,Home & Lifestyle->Personal Care->Antiperspirant & Deodorant,,4.99,,,,,,,HLPCAD083,HLPCAD083.JPG,,taxable,standard-rate
Old Spice Fiji Deodorant 85g,,,Home & Lifestyle->Personal Care->Antiperspirant & Deodorant,,4.99,,,,,,,HLPCAD084,HLPCAD084.JPG,,taxable,standard-rate
Old Spice Champion Antiperspirant & Deodorant 73g,,,Home & Lifestyle->Personal Care->Antiperspirant & Deodorant,,4.99,,,,,,,HLPCAD085,HLPCAD085.JPG,,taxable,standard-rate
Old Spice Champion Deodorant 85g,,,Home & Lifestyle->Personal Care->Antiperspirant & Deodorant,,4.99,,,,,,,HLPCAD086,HLPCAD086.JPG,,taxable,standard-rate
Old Spice Fiji Antiperspirant & Deodorant 73g,,,Home & Lifestyle->Personal Care->Antiperspirant & Deodorant,,4.99,,,,,,,HLPCAD087,HLPCAD087.JPG,,taxable,standard-rate
Old Spice Denali Antiperspirant & Deodorant 73g,,,Home & Lifestyle->Personal Care->Antiperspirant & Deodorant,,4.99,,,,,,,HLPCAD088,HLPCAD088.JPG,,taxable,standard-rate
Old Spice Matterhorn Antiperspirant & Deodorant 73g,,,Home & Lifestyle->Personal Care->Antiperspirant & Deodorant,,4.99,,,,,,,HLPCAD089,HLPCAD089.JPG,,taxable,standard-rate
Old Spice Smooth Blast HighEndurance Antiperspirant & Deodorant 85g,,,Home & Lifestyle->Personal Care->Antiperspirant & Deodorant,,4.99,,,,,,,HLPCAD090,HLPCAD090.JPG,,taxable,standard-rate
Dove Men+Care Clean Comfort Antiperspirant 76g,,,Home & Lifestyle->Personal Care->Antiperspirant & Deodorant,,5.79,,,,,,,HLPCAD091,HLPCAD091.JPG,,taxable,standard-rate
Dove Men+Care Clean Comfort Deodorant 85g,,,Home & Lifestyle->Personal Care->Antiperspirant & Deodorant,,5.79,,,,,,,HLPCAD092,HLPCAD092.JPG,,taxable,standard-rate
Dove Men+Care Aqua Impact Deodorant 85g,,,Home & Lifestyle->Personal Care->Antiperspirant & Deodorant,,5.79,,,,,,,HLPCAD093,HLPCAD093.JPG,,taxable,standard-rate
Dove Men+Care Aqua Impact Antiperspirant 76g,,,Home & Lifestyle->Personal Care->Antiperspirant & Deodorant,,5.79,,,,,,,HLPCAD094,HLPCAD094.JPG,,taxable,standard-rate
Dove Men+Care Clinical Clean Comfort Antiperspirant 48g,,,Home & Lifestyle->Personal Care->Antiperspirant & Deodorant,,9.99,,,,,,,HLPCAD095,HLPCAD095.JPG,,taxable,standard-rate
Degree Dry Protection Body Heat Cool Comfort Antiperspirant 76g,,,Home & Lifestyle->Personal Care->Antiperspirant & Deodorant,,3.79,,,,,,,HLPCAD096,HLPCAD096.JPG,,taxable,standard-rate
Degree Adrenaline Extreme Antiperspirant Stick 76g,,,Home & Lifestyle->Personal Care->Antiperspirant & Deodorant,,4.49,,,,,,,HLPCAD097,HLPCAD097.JPG,,taxable,standard-rate
Degree Dry Protection Body Heat Sport Antiperspirant 76g,,,Home & Lifestyle->Personal Care->Antiperspirant & Deodorant,,4.49,,,,,,,HLPCAD098,HLPCAD098.JPG,,taxable,standard-rate
Degree Adrenaline Adventure Antiperspirant Stick 76g,,,Home & Lifestyle->Personal Care->Antiperspirant & Deodorant,,4.49,,,,,,,HLPCAD099,HLPCAD099.JPG,,taxable,standard-rate
Degree Time Released Arctic Edge Deodorant 85g,,,Home & Lifestyle->Personal Care->Antiperspirant & Deodorant,,4.49,,,,,,,HLPCAD100,HLPCAD100.JPG,,taxable,standard-rate
Degree Adrenaline Sport Defense Antiperspirant Stick 76g,,,Home & Lifestyle->Personal Care->Antiperspirant & Deodorant,,4.49,,,,,,,HLPCAD101,HLPCAD101.JPG,,taxable,standard-rate
Speed Stick Original Deodorant 92g,,,Home & Lifestyle->Personal Care->Antiperspirant & Deodorant,,3.79,,,,,,,HLPCAD102,HLPCAD102.JPG,,taxable,standard-rate
Speed Stick Power Energy Surge Antiperspirant 85g,,,Home & Lifestyle->Personal Care->Antiperspirant & Deodorant,,3.79,,,,,,,HLPCAD103,HLPCAD103.JPG,,taxable,standard-rate
Speed Stick Power Fresh Antiperspirant 85g,,,Home & Lifestyle->Personal Care->Antiperspirant & Deodorant,,3.79,,,,,,,HLPCAD104,HLPCAD104.JPG,,taxable,standard-rate
Speed Stick Gel Power Fresh Antiperspirant 85g,,,Home & Lifestyle->Personal Care->Antiperspirant & Deodorant,,3.79,,,,,,,HLPCAD105,HLPCAD105.JPG,,taxable,standard-rate
Speed Stick Glacier Deodorant 85g,,,Home & Lifestyle->Personal Care->Antiperspirant & Deodorant,,3.79,,,,,,,HLPCAD106,HLPCAD106.JPG,,taxable,standard-rate
Speed Stick Stainguard Fresh Antiperspirant 76g,,,Home & Lifestyle->Personal Care->Antiperspirant & Deodorant,,5.79,,,,,,,HLPCAD107,HLPCAD107.JPG,,taxable,standard-rate
Speed Stick Stainguard Clean Antiperspirant 76g,,,Home & Lifestyle->Personal Care->Antiperspirant & Deodorant,,5.79,,,,,,,HLPCAD108,HLPCAD108.JPG,,taxable,standard-rate
Gillette Power Beads Fast Drying Cool Wave Antiperspirant & Deodorant 85g,,,Home & Lifestyle->Personal Care->Antiperspirant & Deodorant,,3.99,,,,,,,HLPCAD109,HLPCAD109.JPG,,taxable,standard-rate
Gillette Clear Gel Fast drying Cool Wave Antiperspirant & Deodorant 85g,,,Home & Lifestyle->Personal Care->Antiperspirant & Deodorant,,4.29,,,,,,,HLPCAD110,HLPCAD110.JPG,,taxable,standard-rate
Gillette Clear Gel Triple Protection Cool Wave Deodorant 85g,,,Home & Lifestyle->Personal Care->Antiperspirant & Deodorant,,4.29,,,,,,,HLPCAD111,HLPCAD111.JPG,,taxable,standard-rate
Gillette Clinical Fresh Power Solid Antiperspirant & Deodorant 48g,,,Home & Lifestyle->Personal Care->Antiperspirant & Deodorant,,9.49,,,,,,,HLPCAD112,HLPCAD112.JPG,,taxable,standard-rate
Gillette Clear Gel Triple Protection Wild Rain Deodorant 85g,,,Home & Lifestyle->Personal Care->Antiperspirant & Deodorant,,4.29,,,,,,,HLPCAD113,HLPCAD113.JPG,,taxable,standard-rate
Gillette Clear Shield Cool Wave Antiperspirant & Deodorant 73g,,,Home & Lifestyle->Personal Care->Antiperspirant & Deodorant,,5.49,,,,,,,HLPCAD114,HLPCAD114.JPG,,taxable,standard-rate
Gillette Odour Shield All Day Clean Antiperspirant & Deodorant 73g,,,Home & Lifestyle->Personal Care->Antiperspirant & Deodorant,,5.99,,,,,,,HLPCAD115,HLPCAD115.JPG,,taxable,standard-rate
Gillette Clear Gel Fast Drying Arctic Ice Antiperspirant & Deodorant 85g,,,Home & Lifestyle->Personal Care->Antiperspirant & Deodorant,,4.29,,,,,,,HLPCAD116,HLPCAD116.JPG,,taxable,standard-rate
Gillette Power Beads Fast Drying Power Rush Antiperspirant & Deodorant 85g,,,Home & Lifestyle->Personal Care->Antiperspirant & Deodorant,,4.29,,,,,,,HLPCAD117,HLPCAD117.JPG,,taxable,standard-rate
Right Guard Total Defense 5 Refresh Antiperspirant & Deodorant 60g,,,Home & Lifestyle->Personal Care->Antiperspirant & Deodorant,,3.99,,,,,,,HLPCAD118,HLPCAD118.JPG,,taxable,standard-rate
Right Guard Total Defense 5 Fresh Blast Antiperspirant & Deodorant 60g,,,Home & Lifestyle->Personal Care->Antiperspirant & Deodorant,,3.99,,,,,,,HLPCAD119,HLPCAD119.JPG,,taxable,standard-rate
Right Gurad Sport 3D Odour Defense Cool Deodorant 85g,,,Home & Lifestyle->Personal Care->Antiperspirant & Deodorant,,3.99,,,,,,,HLPCAD120,HLPCAD120.JPG,,taxable,standard-rate
Irish Spring Icy Blast Deodorant 92g,,,Home & Lifestyle->Personal Care->Antiperspirant & Deodorant,,5.79,,,,,,,HLPCAD121,HLPCAD121.JPG,,taxable,standard-rate
Irish Spring Icy Blast Antiperspirant 92g,,,Home & Lifestyle->Personal Care->Antiperspirant & Deodorant,,5.79,,,,,,,HLPCAD122,HLPCAD122.JPG,,taxable,standard-rate
Irish Spring Legendary Classic Antiperspirant 92g,,,Home & Lifestyle->Personal Care->Antiperspirant & Deodorant,,5.79,,,,,,,HLPCAD123,HLPCAD123.JPG,,taxable,standard-rate
Irish Spring Legendary Classic Deodorant 92g,,,Home & Lifestyle->Personal Care->Antiperspirant & Deodorant,,5.79,,,,,,,HLPCAD124,HLPCAD124.JPG,,taxable,standard-rate
