title,description,short_description,category,stock,price,regular_price,sales_prices,weight,length,width,height,sku,picture,tags,tax_status,tax_class
Eukanuba Adult Maintenance 7.5kg,,,Dog->Dry Food-> Premium ,,44.99,,,,,,,DFDP001,DFDP001.JPG,,taxable,standard-rate
Eukanuba Adult Maintenance 15kg,,,Dog->Dry Food-> Premium ,,54.99,,,,,,,DFDP002,DFDP002.JPG,,taxable,standard-rate
Eukanuba Adult Maintenance Small Bite 7.4kg,,,Dog->Dry Food-> Premium ,,44.99,,,,,,,DFDP003,DFDP003.JPG,,taxable,standard-rate
Eukanuba Adult Maintenance Small Bite 15kg,,,Dog->Dry Food-> Premium ,,54.99,,,,,,,DFDP004,DFDP004.JPG,,taxable,standard-rate
Eukanuba Adult Small Breed 1.8Kg,,,Dog->Dry Food-> Premium ,,16.99,,,,,,,DFDP005,DFDP005.JPG,,taxable,standard-rate
Eukanuba Adult Small Breed 15Kg,,,Dog->Dry Food-> Premium ,,54.99,,,,,,,DFDP006,DFDP006.JPG,,taxable,standard-rate
Eukanuba Puppy Growth 2.27kg,,,Dog->Dry Food-> Premium ,,16.99,,,,,,,DFDP007,DFDP007.JPG,,taxable,standard-rate
Eukanuba Puppy Growth 15kg,,,Dog->Dry Food-> Premium ,,59.99,,,,,,,DFDP008,DFDP008.JPG,,taxable,standard-rate
Eukanuba Small Breed Puppy 1.8kg,,,Dog->Dry Food-> Premium ,,16.99,,,,,,,DFDP009,DFDP009.JPG,,taxable,standard-rate
Eukanuba Large Breed Puppy 15kg,,,Dog->Dry Food-> Premium ,,54.99,,,,,,,DFDP010,DFDP010.JPG,,taxable,standard-rate
Eukanuba Large Breed Senior 13.6kg,,,Dog->Dry Food-> Premium ,,59.99,,,,,,,DFDP011,DFDP011.JPG,,taxable,standard-rate
Eukanuba Labrador Retriever 16.3kg,,,Dog->Dry Food-> Premium ,,69.99,,,,,,,DFDP012,DFDP012.JPG,,taxable,standard-rate
Royal Canin Breed Boxer 26 1.14kg,,,Dog->Dry Food-> Premium ,,12.99,,,,,,,DFDP013,DFDP013.JPG,,taxable,standard-rate
Royal Canin Breed Boxer 26 13.5kg,,,Dog->Dry Food-> Premium ,,79.99,,,,,,,DFDP014,DFDP014.JPG,,taxable,standard-rate
Royal Canin Breed Bulldog 24 1.14kg,,,Dog->Dry Food-> Premium ,,12.99,,,,,,,DFDP015,DFDP015.JPG,,taxable,standard-rate
Royal Canin Breed Bulldog 24 13.6kg,,,Dog->Dry Food-> Premium ,,79.99,,,,,,,DFDP016,DFDP016.JPG,,taxable,standard-rate
Royal Canin Breed Bulldog Puppy 13.6kg,,,Dog->Dry Food-> Premium ,,81.99,,,,,,,DFDP017,DFDP017.JPG,,taxable,standard-rate
Royal Canin Breed Chihuahua 28 1.12kg ,,,Dog->Dry Food-> Premium ,,19.99,,,,,,,DFDP018,DFDP018.JPG,,taxable,standard-rate
Royal Canin Breed Chihuahua 28 6.81kg,,,Dog->Dry Food-> Premium ,,69.99,,,,,,,DFDP019,DFDP019.JPG,,taxable,standard-rate
Royal Canin Breed Chihuahua Puppy 30 1.1kg,,,Dog->Dry Food-> Premium ,,24.99,,,,,,,DFDP020,DFDP020.JPG,,taxable,standard-rate
Royal Canin Breed Cocker Spaniel 25 1.14kg,,,Dog->Dry Food-> Premium ,,12.99,,,,,,,DFDP021,DFDP021.JPG,,taxable,standard-rate
Royal Canin Breed Cocker Spaniel 25 11.3kg,,,Dog->Dry Food-> Premium ,,68.99,,,,,,,DFDP022,DFDP022.JPG,,taxable,standard-rate
Royal Canin Breed Dachshund 28 1.12kg,,,Dog->Dry Food-> Premium ,,19.99,,,,,,,DFDP023,DFDP023.JPG,,taxable,standard-rate
Royal Canin Breed Dachshund 28 4.5kg,,,Dog->Dry Food-> Premium ,,49.99,,,,,,,DFDP024,DFDP024.JPG,,taxable,standard-rate
Royal Canin Breed German Shepherd 24 1.14kg,,,Dog->Dry Food-> Premium ,,12.99,,,,,,,DFDP025,DFDP025.JPG,,taxable,standard-rate
Royal Canin Breed German Shepherd 13.5kg,,,Dog->Dry Food-> Premium ,,79.99,,,,,,,DFDP026,DFDP026.JPG,,taxable,standard-rate
Royal Canin Breed German Shepherd Puppy 13.6kg,,,Dog->Dry Food-> Premium ,,79.99,,,,,,,DFDP027,DFDP027.JPG,,taxable,standard-rate
Royal Canin Breed Golden Retriever 25 1.14kg,,,Dog->Dry Food-> Premium ,,12.99,,,,,,,DFDP028,DFDP028.JPG,,taxable,standard-rate
Royal Canin Breed Golden Retriever 25 13.5kg,,,Dog->Dry Food-> Premium ,,79.99,,,,,,,DFDP029,DFDP029.JPG,,taxable,standard-rate
Royal Canin Breed Labrador Retriever 30 1.14kg,,,Dog->Dry Food-> Premium ,,12.99,,,,,,,DFDP030,DFDP030.JPG,,taxable,standard-rate
Royal Canin Breed Labrador Retriever 30 13.5kg,,,Dog->Dry Food-> Premium ,,79.99,,,,,,,DFDP031,DFDP031.JPG,,taxable,standard-rate
Royal Canin Breed Labrador Retriever Puppy 33 13.6kg,,,Dog->Dry Food-> Premium ,,79.99,,,,,,,DFDP032,DFDP032.JPG,,taxable,standard-rate
Royal Canin Breed Miniature Schnauzer 25 4.5kg,,,Dog->Dry Food-> Premium ,,54.99,,,,,,,DFDP033,DFDP033.JPG,,taxable,standard-rate
Royal Canin Breed Poodle 1.13kg,,,Dog->Dry Food-> Premium ,,19.99,,,,,,,DFDP034,DFDP034.JPG,,taxable,standard-rate
Royal Canin Breed Poodle 4.5kg,,,Dog->Dry Food-> Premium ,,49.99,,,,,,,DFDP035,DFDP035.JPG,,taxable,standard-rate
Royal Canin Breed Pug 25 1.13kg,,,Dog->Dry Food-> Premium ,,19.99,,,,,,,DFDP036,DFDP036.JPG,,taxable,standard-rate
Royal Canin Breed Pug 25 4.5kg,,,Dog->Dry Food-> Premium ,,54.99,,,,,,,DFDP037,DFDP037.JPG,,taxable,standard-rate
Royal Canin Breed Rottweiller 1.1kg,,,Dog->Dry Food-> Premium ,,12.99,,,,,,,DFDP038,DFDP038.JPG,,taxable,standard-rate
Royal Canin Breed Rottweiller 13.6kg,,,Dog->Dry Food-> Premium ,,81.99,,,,,,,DFDP039,DFDP039.JPG,,taxable,standard-rate
Royal Canin Breed Rottweiller Puppy 13.6kg,,,Dog->Dry Food-> Premium ,,81.99,,,,,,,DFDP040,DFDP040.JPG,,taxable,standard-rate
Royal Canin Breed Shih Tzu 24 1.12kg,,,Dog->Dry Food-> Premium ,,19.99,,,,,,,DFDP041,DFDP041.JPG,,taxable,standard-rate
Royal Canin Breed Shih Tzu 24 Puppy 1.13kg,,,Dog->Dry Food-> Premium ,,24.99,,,,,,,DFDP042,DFDP042.JPG,,taxable,standard-rate
Royal Canin Breed Yorkshire Terrier 28 1.12kg,,,Dog->Dry Food-> Premium ,,19.99,,,,,,,DFDP043,DFDP043.JPG,,taxable,standard-rate
Royal Canin Breed Yorkshire Terrier 28 4.5kg,,,Dog->Dry Food-> Premium ,,54.99,,,,,,,DFDP044,DFDP044.JPG,,taxable,standard-rate
Royal Canin Breed Yorkshire Terrier 29 Puppy 1.1kg,,,Dog->Dry Food-> Premium ,,24.99,,,,,,,DFDP045,DFDP045.JPG,,taxable,standard-rate
Royal Canin Extra Small Puppy 1.36kg,,,Dog->Dry Food-> Premium ,,23.99,,,,,,,DFDP046,DFDP046.JPG,,taxable,standard-rate
Royal Canin Extra Small Puppy 6.8kg,,,Dog->Dry Food-> Premium ,,66.99,,,,,,,DFDP047,DFDP047.JPG,,taxable,standard-rate
Royal Canin Extra Small Adult 1.13kg,,,Dog->Dry Food-> Premium ,,18.99,,,,,,,DFDP048,DFDP048.JPG,,taxable,standard-rate
Royal Canin Extra Small Adult 6.36kg,,,Dog->Dry Food-> Premium ,,58.99,,,,,,,DFDP049,DFDP049.JPG,,taxable,standard-rate
Royal Canin Extra Small Mature +8 1.13kg,,,Dog->Dry Food-> Premium ,,19.99,,,,,,,DFDP050,DFDP050.JPG,,taxable,standard-rate
Royal Canin Extra Small Mature +8 5.9kg,,,Dog->Dry Food-> Premium ,,56.99,,,,,,,DFDP051,DFDP051.JPG,,taxable,standard-rate
Royal Canin Extra Small Aging +12 1.13kg,,,Dog->Dry Food-> Premium ,,19.99,,,,,,,DFDP052,DFDP052.JPG,,taxable,standard-rate
Royal Canin Extra Small Aging +12 5.9kg,,,Dog->Dry Food-> Premium ,,57.99,,,,,,,DFDP053,DFDP053.JPG,,taxable,standard-rate
Royal Canin Mini Starter 0.91kg,,,Dog->Dry Food-> Premium ,,16.99,,,,,,,DFDP054,DFDP054.JPG,,taxable,standard-rate
Royal Canin Mini Starter 6.8kg,,,Dog->Dry Food-> Premium ,,69.99,,,,,,,DFDP055,DFDP055.JPG,,taxable,standard-rate
Royal Canin Mini Puppy 33 1.13kg,,,Dog->Dry Food-> Premium ,,19.99,,,,,,,DFDP056,DFDP056.JPG,,taxable,standard-rate
Royal Canin Mini Puppy 33 5.91kg,,,Dog->Dry Food-> Premium ,,59.99,,,,,,,DFDP057,DFDP057.JPG,,taxable,standard-rate
Royal Canin Mini Indoor Puppy 1.13kg,,,Dog->Dry Food-> Premium ,,19.99,,,,,,,DFDP058,DFDP058.JPG,,taxable,standard-rate
Royal Canin Mini Adult 2kg ,,,Dog->Dry Food-> Premium ,,24.99,,,,,,,DFDP059,DFDP059.JPG,,taxable,standard-rate
Royal Canin Mini Adult 6.36kg ,,,Dog->Dry Food-> Premium ,,47.99,,,,,,,DFDP060,DFDP060.JPG,,taxable,standard-rate
Royal Canin Mini Special 1.59kg ,,,Dog->Dry Food-> Premium ,,23.99,,,,,,,DFDP061,DFDP061.JPG,,taxable,standard-rate
Royal Canin Mini Special 7.7kg,,,Dog->Dry Food-> Premium ,,64.99,,,,,,,DFDP062,DFDP062.JPG,,taxable,standard-rate
Royal Canin Mini Weight Care 30 1.14kg,,,Dog->Dry Food-> Premium ,,18.99,,,,,,,DFDP063,DFDP063.JPG,,taxable,standard-rate
Royal Canin Mini Weight Care 30 5.9kg,,,Dog->Dry Food-> Premium ,,49.99,,,,,,,DFDP064,DFDP064.JPG,,taxable,standard-rate
Royal Canin Mini Indoor Adult 1.35kg ,,,Dog->Dry Food-> Premium ,,19.99,,,,,,,DFDP065,DFDP065.JPG,,taxable,standard-rate
Royal Canin Mini Indoor Adult 6.75kg,,,Dog->Dry Food-> Premium ,,59.99,,,,,,,DFDP066,DFDP066.JPG,,taxable,standard-rate
Royal Canin Mini Dermacomfort 1.36kg,,,Dog->Dry Food-> Premium ,,19.99,,,,,,,DFDP067,DFDP067.JPG,,taxable,standard-rate
Royal Canin Mini Spayed/Neutered 1.13kg,,,Dog->Dry Food-> Premium ,,18.99,,,,,,,DFDP068,DFDP068.JPG,,taxable,standard-rate
Royal Canin Mini Indoor Mature +8 1.36kg,,,Dog->Dry Food-> Premium ,,19.99,,,,,,,DFDP069,DFDP069.JPG,,taxable,standard-rate
Royal Canin Mini Aging +12 1.13kg,,,Dog->Dry Food-> Premium ,,18.99,,,,,,,DFDP070,DFDP070.JPG,,taxable,standard-rate
Royal Canin Mini Indoor Aging +12 1.36kg,,,Dog->Dry Food-> Premium ,,19.99,,,,,,,DFDP071,DFDP071.JPG,,taxable,standard-rate
Royal Canin Mini Aging Care 27 1.14kg ,,,Dog->Dry Food-> Premium ,,17.99,,,,,,,DFDP072,DFDP072.JPG,,taxable,standard-rate
Royal Canin Mini Aging Care 27 5.91kg,,,Dog->Dry Food-> Premium ,,49.99,,,,,,,DFDP073,DFDP073.JPG,,taxable,standard-rate
Royal Canin Medium Adult 2.7kg,,,Dog->Dry Food-> Premium ,,24.99,,,,,,,DFDP074,DFDP074.JPG,,taxable,standard-rate
Royal Canin Medium Adult 13.5kg ,,,Dog->Dry Food-> Premium ,,68.99,,,,,,,DFDP075,DFDP075.JPG,,taxable,standard-rate
Royal Canin Medium Age Care 25 13.6kg,,,Dog->Dry Food-> Premium ,,72.99,,,,,,,DFDP076,DFDP076.JPG,,taxable,standard-rate
Royal Canin Medium Dermacomfort 3.18kg,,,Dog->Dry Food-> Premium ,,29.99,,,,,,,DFDP077,DFDP077.JPG,,taxable,standard-rate
Royal Canin Medium Dermacomfort 13.9kg,,,Dog->Dry Food-> Premium ,,74.99,,,,,,,DFDP078,DFDP078.JPG,,taxable,standard-rate
Royal Canin Medium Sensitive Digestion 2.5kg,,,Dog->Dry Food-> Premium ,,24.99,,,,,,,DFDP079,DFDP079.JPG,,taxable,standard-rate
Royal Canin Medium Puppy 2.7kg,,,Dog->Dry Food-> Premium ,,29.99,,,,,,,DFDP080,DFDP080.JPG,,taxable,standard-rate
Royal Canin Medium Puppy 13.5kg,,,Dog->Dry Food-> Premium ,,74.99,,,,,,,DFDP081,DFDP081.JPG,,taxable,standard-rate
Royal Canin Maxi Adult 15.75kg,,,Dog->Dry Food-> Premium ,,74.99,,,,,,,DFDP082,DFDP082.JPG,,taxable,standard-rate
Royal Canin Maxi Joint and Coat Care 28 13.5kg,,,Dog->Dry Food-> Premium ,,74.99,,,,,,,DFDP083,DFDP083.JPG,,taxable,standard-rate
Royal Canin Maxi Dermacomfort 15.9kg,,,Dog->Dry Food-> Premium ,,79.99,,,,,,,DFDP084,DFDP084.JPG,,taxable,standard-rate
Royal Canin Maxi Puppy 2.7kg,,,Dog->Dry Food-> Premium ,,24.99,,,,,,,DFDP085,DFDP085.JPG,,taxable,standard-rate
Royal Canin Maxi Puppy 8.18kg,,,Dog->Dry Food-> Premium ,,58.99,,,,,,,DFDP086,DFDP086.JPG,,taxable,standard-rate
Royal Canin Maxi Puppy 15.75kg,,,Dog->Dry Food-> Premium ,,79.99,,,,,,,DFDP087,DFDP087.JPG,,taxable,standard-rate
Royal Canin Maxi Aging Care 26 13.5kg,,,Dog->Dry Food-> Premium ,,74.99,,,,,,,DFDP088,DFDP088.JPG,,taxable,standard-rate
Royal Canin Maxi Starter 2.72kg,,,Dog->Dry Food-> Premium ,,28.99,,,,,,,DFDP089,DFDP089.JPG,,taxable,standard-rate
Royal Canin Maxi Starter 11.79kg,,,Dog->Dry Food-> Premium ,,76.99,,,,,,,DFDP090,DFDP090.JPG,,taxable,standard-rate
Royal Canin Giant Adult 28 15.75kg,,,Dog->Dry Food-> Premium ,,79.99,,,,,,,DFDP091,DFDP091.JPG,,taxable,standard-rate
Royal Canin Giant Puppy 2.72kg,,,Dog->Dry Food-> Premium ,,24.99,,,,,,,DFDP092,DFDP092.JPG,,taxable,standard-rate
Royal Canin Giant Puppy 13.6kg,,,Dog->Dry Food-> Premium ,,79.99,,,,,,,DFDP093,DFDP093.JPG,,taxable,standard-rate
Techni-Cal Adult 15kg ,,,Dog->Dry Food-> Premium ,,54.99,,,,,,,DFDP094,DFDP094.JPG,,taxable,standard-rate
