title,description,short_description,category,stock,price,regular_price,sales_prices,weight,length,width,height,sku,picture,tags,tax_status,tax_class
Elite Chicken Salad with Wheat Crackers 95g,,,Groceries->Soups & Cans->Canned Meat ,,1.99,,,,,,,GSCCM001,GSCCM001.JPG,,taxable,standard-rate
Elite Chicken Salad with Cranberries and Wheat Crackers 95g,,,Groceries->Soups & Cans->Canned Meat ,,1.99,,,,,,,GSCCM002,GSCCM002.JPG,,taxable,standard-rate
Clover Leaf Tuna Salad Kit Rosemary & Sundried Tomato 90g,,,Groceries->Soups & Cans->Canned Meat ,,2.39,,,,,,,GSCCM003,GSCCM003.JPG,,taxable,standard-rate
Clover Leaf Tuna Salad Kit Lemon & Pepper 90g,,,Groceries->Soups & Cans->Canned Meat ,,2.39,,,,,,,GSCCM004,GSCCM004.JPG,,taxable,standard-rate
Clover Leaf Tuna Salad Kit Spicy Thai Chili 90g,,,Groceries->Soups & Cans->Canned Meat ,,2.39,,,,,,,GSCCM005,GSCCM005.JPG,,taxable,standard-rate
Clover Leaf Whole Baby Clams in Water 142g,,,Groceries->Soups & Cans->Canned Meat ,,2.79,,,,,,,GSCCM006,GSCCM006.JPG,,taxable,standard-rate
Clover Leaf Clam Juice Natural 236ml,,,Groceries->Soups & Cans->Canned Meat ,,2.49,,,,,,,GSCCM007,GSCCM007.JPG,,taxable,standard-rate
Compliments Small Shrimp 106g,,,Groceries->Soups & Cans->Canned Meat ,,3.99,,,,,,,GSCCM008,GSCCM008.JPG,,taxable,standard-rate
Clover Leaf Crabmeat with 15% Leg Meat 120g,,,Groceries->Soups & Cans->Canned Meat ,,3.79,,,,,,,GSCCM009,GSCCM009.JPG,,taxable,standard-rate
Clover Leaf Chunk Crabmeat 120g,,,Groceries->Soups & Cans->Canned Meat ,,6.49,,,,,,,GSCCM010,GSCCM010.JPG,,taxable,standard-rate
Encore Seasoning Mix Escargot 7g,,,Groceries->Soups & Cans->Canned Meat ,,0.99,,,,,,,GSCCM011,GSCCM011.JPG,,taxable,standard-rate
M'Lord Snails 115g,,,Groceries->Soups & Cans->Canned Meat ,,2.79,,,,,,,GSCCM012,GSCCM012.JPG,,taxable,standard-rate
Clover Leaf Cocktail Shrimp 106g,,,Groceries->Soups & Cans->Canned Meat ,,4.79,,,,,,,GSCCM013,GSCCM013.JPG,,taxable,standard-rate
Brunswick Seafood Snacks Fish Fillets in Hot Sauce 100g,,,Groceries->Soups & Cans->Canned Meat ,,1.49,,,,,,,GSCCM014,GSCCM014.JPG,,taxable,standard-rate
Brunswick Seafood Snacks Fish Fillets in Tomato & Basil Sauce 100g,,,Groceries->Soups & Cans->Canned Meat ,,1.49,,,,,,,GSCCM015,GSCCM015.JPG,,taxable,standard-rate
Brunswick Seafood Snacks Fish Fillets in Golden Smoked 100g,,,Groceries->Soups & Cans->Canned Meat ,,1.49,,,,,,,GSCCM016,GSCCM016.JPG,,taxable,standard-rate
Brunswick Seafood Snacks Fish Fillets Kippered 100g,,,Groceries->Soups & Cans->Canned Meat ,,1.49,,,,,,,GSCCM017,GSCCM017.JPG,,taxable,standard-rate
Club Des Millionnaires Sardines Skiness and Boneless 124g,,,Groceries->Soups & Cans->Canned Meat ,,2.99,,,,,,,GSCCM018,GSCCM018.JPG,,taxable,standard-rate
Club Des Millionnaires in Water Sardines 124g,,,Groceries->Soups & Cans->Canned Meat ,,2.99,,,,,,,GSCCM019,GSCCM019.JPG,,taxable,standard-rate
Club Des Millionnaires Brisling Sardines Slightly Smoked 100g,,,Groceries->Soups & Cans->Canned Meat ,,2.99,,,,,,,GSCCM020,GSCCM020.JPG,,taxable,standard-rate
Clover Leaf Brisling Sardines in Olive Oil 106g,,,Groceries->Soups & Cans->Canned Meat ,,3.49,,,,,,,GSCCM021,GSCCM021.JPG,,taxable,standard-rate
Brunswick Sardines in Soya Oil 106g,,,Groceries->Soups & Cans->Canned Meat ,,1.42,,,,,,,GSCCM022,GSCCM022.JPG,,taxable,standard-rate
Brunswick Sardines in Spring Water No Salted 84g,,,Groceries->Soups & Cans->Canned Meat ,,1.42,,,,,,,GSCCM023,GSCCM023.JPG,,taxable,standard-rate
Brunswick Sardines with Hot Peppers 106g,,,Groceries->Soups & Cans->Canned Meat ,,1.42,,,,,,,GSCCM024,GSCCM024.JPG,,taxable,standard-rate
Brunswick Sardines in Tomato Sauce 106g,,,Groceries->Soups & Cans->Canned Meat ,,1.42,,,,,,,GSCCM025,GSCCM025.JPG,,taxable,standard-rate
Brunswick Sardines in Lemon Sauce 106g,,,Groceries->Soups & Cans->Canned Meat ,,1.42,,,,,,,GSCCM026,GSCCM026.JPG,,taxable,standard-rate
Clover Leaf Smoked Mussels Hardwood Smoked 85g,,,Groceries->Soups & Cans->Canned Meat ,,2.29,,,,,,,GSCCM027,GSCCM027.JPG,,taxable,standard-rate
Compliments Whole Smoked Mussels 85g,,,Groceries->Soups & Cans->Canned Meat ,,1.99,,,,,,,GSCCM028,GSCCM028.JPG,,taxable,standard-rate
Compliments Whole Smoked Oysters 85g,,,Groceries->Soups & Cans->Canned Meat ,,1.99,,,,,,,GSCCM029,GSCCM029.JPG,,taxable,standard-rate
Clover Leaf Smoked Oysters Hardwood Smoked 85g,,,Groceries->Soups & Cans->Canned Meat ,,2.29,,,,,,,GSCCM030,GSCCM030.JPG,,taxable,standard-rate
Clover Leaf Solid Light Tuna Yellowfin in Olive Oil 85g,,,Groceries->Soups & Cans->Canned Meat ,,1.79,,,,,,,GSCCM031,GSCCM031.JPG,,taxable,standard-rate
Clover Leaf Solid White Tuna in Water 85g,,,Groceries->Soups & Cans->Canned Meat ,,1.79,,,,,,,GSCCM032,GSCCM032.JPG,,taxable,standard-rate
Clover Leaf Flaked Light Tuna Sundried Tomato & Basil 85g,,,Groceries->Soups & Cans->Canned Meat ,,1.79,,,,,,,GSCCM033,GSCCM033.JPG,,taxable,standard-rate
Clover Leaf Flaked Light Tuna Dill & Lemon 85g,,,Groceries->Soups & Cans->Canned Meat ,,1.79,,,,,,,GSCCM034,GSCCM034.JPG,,taxable,standard-rate
Clover Leaf Flaked Light Tuna Tomato & Onion 85g,,,Groceries->Soups & Cans->Canned Meat ,,1.79,,,,,,,GSCCM035,GSCCM035.JPG,,taxable,standard-rate
Clover Leaf Flaked Light Tuna Lemon & Pepper 85g,,,Groceries->Soups & Cans->Canned Meat ,,1.79,,,,,,,GSCCM036,GSCCM036.JPG,,taxable,standard-rate
Compliments Balance Flaked Light Tuna Lemon & Pepper 85g,,,Groceries->Soups & Cans->Canned Meat ,,1.12,,,,,,,GSCCM037,GSCCM037.JPG,,taxable,standard-rate
Compliments Balance Flaked Light Tuna Tomato & Onion 85g,,,Groceries->Soups & Cans->Canned Meat ,,1.12,,,,,,,GSCCM038,GSCCM038.JPG,,taxable,standard-rate
Compliments Balance Flaked Light tuna Spicy Thai Chili 85g,,,Groceries->Soups & Cans->Canned Meat ,,1.12,,,,,,,GSCCM039,GSCCM039.JPG,,taxable,standard-rate
Clover Leaf Flaked Light Tuna Garlic & Hot Pepper 85g,,,Groceries->Soups & Cans->Canned Meat ,,1.79,,,,,,,GSCCM040,GSCCM040.JPG,,taxable,standard-rate
Clover Leaf Flaked Light Tuna Spicy Thai Chili 85g,,,Groceries->Soups & Cans->Canned Meat ,,1.79,,,,,,,GSCCM041,GSCCM041.JPG,,taxable,standard-rate
Clover Leaf Chipotle Chunk White Tuna 142g,,,Groceries->Soups & Cans->Canned Meat ,,3.37,,,,,,,GSCCM042,GSCCM042.JPG,,taxable,standard-rate
Clover Leaf Jalapeno in Olive Oil 142g,,,Groceries->Soups & Cans->Canned Meat ,,3.37,,,,,,,GSCCM043,GSCCM043.JPG,,taxable,standard-rate
Clover Leaf Sundried Tomato in Olive Oil 142g,,,Groceries->Soups & Cans->Canned Meat ,,3.37,,,,,,,GSCCM044,GSCCM044.JPG,,taxable,standard-rate
Sensations White Tuna in Water Solid Albacore 170g,,,Groceries->Soups & Cans->Canned Meat ,,2.49,,,,,,,GSCCM045,GSCCM045.JPG,,taxable,standard-rate
Clover Leaf Solid White Tuna in Water 170g,,,Groceries->Soups & Cans->Canned Meat ,,2.99,,,,,,,GSCCM046,GSCCM046.JPG,,taxable,standard-rate
Clover Leaf Solid White Yellowfin Tuna Vegetable Broth & Oil 170g,,,Groceries->Soups & Cans->Canned Meat ,,2.99,,,,,,,GSCCM047,GSCCM047.JPG,,taxable,standard-rate
Clover Leaf Chunk White Tuna in Water 170g,,,Groceries->Soups & Cans->Canned Meat ,,2.79,,,,,,,GSCCM048,GSCCM048.JPG,,taxable,standard-rate
GoldSeal Solid White Tuna Albacore in Water 170g,,,Groceries->Soups & Cans->Canned Meat ,,2.49,,,,,,,GSCCM049,GSCCM049.JPG,,taxable,standard-rate
GoldSeal Sockeye Red Salmon 213g,,,Groceries->Soups & Cans->Canned Meat ,,3.29,,,,,,,GSCCM050,GSCCM050.JPG,,taxable,standard-rate
Sensations Sockeye Salmon 213g,,,Groceries->Soups & Cans->Canned Meat ,,3.49,,,,,,,GSCCM051,GSCCM051.JPG,,taxable,standard-rate
Clover Leaf Sockeye Red Salmon 213g,,,Groceries->Soups & Cans->Canned Meat ,,4.29,,,,,,,GSCCM052,GSCCM052.JPG,,taxable,standard-rate
Clover Leaf Sockeye Red Salmon Low Sodium 213g,,,Groceries->Soups & Cans->Canned Meat ,,4.49,,,,,,,GSCCM053,GSCCM053.JPG,,taxable,standard-rate
Clover Leaf Skiness and Boneless Sockeye Salmon in Water 150g,,,Groceries->Soups & Cans->Canned Meat ,,4.99,,,,,,,GSCCM054,GSCCM054.JPG,,taxable,standard-rate
Clover Leaf Sockeye Salmon 106g,,,Groceries->Soups & Cans->Canned Meat ,,2.49,,,,,,,GSCCM055,GSCCM055.JPG,,taxable,standard-rate
Sensations White Tuna in Water Solid Albacore Low Sodium 170g,,,Groceries->Soups & Cans->Canned Meat ,,2.49,,,,,,,GSCCM056,GSCCM056.JPG,,taxable,standard-rate
Sensations White Tuna in Water Solid Flaked Albacore 170g,,,Groceries->Soups & Cans->Canned Meat ,,2.49,,,,,,,GSCCM057,GSCCM057.JPG,,taxable,standard-rate
Clover Leaf Flaked White Tuna in Water 170g,,,Groceries->Soups & Cans->Canned Meat ,,2.79,,,,,,,GSCCM058,GSCCM058.JPG,,taxable,standard-rate
Clover Leaf Solid White Tuna in Water Low Sodium 170g,,,Groceries->Soups & Cans->Canned Meat ,,2.99,,,,,,,GSCCM059,GSCCM059.JPG,,taxable,standard-rate
Goldseal Flaked White Tuna Albacore in Water 170g,,,Groceries->Soups & Cans->Canned Meat ,,2.49,,,,,,,GSCCM060,GSCCM060.JPG,,taxable,standard-rate
GoldSeal Pink Salmon 213g,,,Groceries->Soups & Cans->Canned Meat ,,2.29,,,,,,,GSCCM061,GSCCM061.JPG,,taxable,standard-rate
Compliments Wild Pacific Pink Salmon 213g,,,Groceries->Soups & Cans->Canned Meat ,,2.49,,,,,,,GSCCM062,GSCCM062.JPG,,taxable,standard-rate
Clover Leaf Pink Salmon 213g,,,Groceries->Soups & Cans->Canned Meat ,,2.49,,,,,,,GSCCM063,GSCCM063.JPG,,taxable,standard-rate
Clover Leaf Skiness and Boneless Pink Salmon in Water 150g,,,Groceries->Soups & Cans->Canned Meat ,,2.49,,,,,,,GSCCM064,GSCCM064.JPG,,taxable,standard-rate
Clover Leaf Skiness and Boneless Atlantic Salmon 170g,,,Groceries->Soups & Cans->Canned Meat ,,3.29,,,,,,,GSCCM065,GSCCM065.JPG,,taxable,standard-rate
Compliments Chunk Light Tuna in Water 170g,,,Groceries->Soups & Cans->Canned Meat ,,1.32,,,,,,,GSCCM066,GSCCM066.JPG,,taxable,standard-rate
Clover Leaf Chunk Light Skip Jack Tuna in Water 170g,,,Groceries->Soups & Cans->Canned Meat ,,1.79,,,,,,,GSCCM067,GSCCM067.JPG,,taxable,standard-rate
GoldSeal Flaked Light Tuna in Water 170g,,,Groceries->Soups & Cans->Canned Meat ,,1.59,,,,,,,GSCCM068,GSCCM068.JPG,,taxable,standard-rate
Goldseal Solid Light Tuna in Oil 130g,,,Groceries->Soups & Cans->Canned Meat ,,1.79,,,,,,,GSCCM069,GSCCM069.JPG,,taxable,standard-rate
Comp Nienna Sausage 113g,,,Groceries->Soups & Cans->Canned Meat ,,1.79,,,,,,,GSCCM070,GSCCM070.JPG,,taxable,standard-rate
Maple Leaf Vienna Sausage 113g,,,Groceries->Soups & Cans->Canned Meat ,,1.99,,,,,,,GSCCM071,GSCCM071.JPG,,taxable,standard-rate
Paris Pate Deviled Ham with Smoke Flavour 78g,,,Groceries->Soups & Cans->Canned Meat ,,1.79,,,,,,,GSCCM072,GSCCM072.JPG,,taxable,standard-rate
Paris Pate Deviled Meat 78g,,,Groceries->Soups & Cans->Canned Meat ,,1.79,,,,,,,GSCCM073,GSCCM073.JPG,,taxable,standard-rate
Clover Leaf Chunk Light Tuna Vegetable Broth & Oil 170g,,,Groceries->Soups & Cans->Canned Meat ,,2.29,,,,,,,GSCCM074,GSCCM074.JPG,,taxable,standard-rate
Clover Leaf Chunk Light Yellowfin Tuna in Water 170g,,,Groceries->Soups & Cans->Canned Meat ,,2.29,,,,,,,GSCCM075,GSCCM075.JPG,,taxable,standard-rate
Clover Leaf Flaked Light Tuna in Water Low Sodium 170g,,,Groceries->Soups & Cans->Canned Meat ,,1.79,,,,,,,GSCCM076,GSCCM076.JPG,,taxable,standard-rate
Compliments Flaked Light Tuna in Water 170g,,,Groceries->Soups & Cans->Canned Meat ,,1.32,,,,,,,GSCCM077,GSCCM077.JPG,,taxable,standard-rate
Clover Leaf Flaked Light Skip Jack Tuna in Water 170g,,,Groceries->Soups & Cans->Canned Meat ,,1.79,,,,,,,GSCCM078,GSCCM078.JPG,,taxable,standard-rate
GoldSeal Chunk Light Tuna in Water 170g,,,Groceries->Soups & Cans->Canned Meat ,,1.59,,,,,,,GSCCM079,GSCCM079.JPG,,taxable,standard-rate
GoldSeal Solid Light Tuna in Water 120g,,,Groceries->Soups & Cans->Canned Meat ,,1.49,,,,,,,GSCCM080,GSCCM080.JPG,,taxable,standard-rate
Compliments Balance Chicken Breast Chunks 142g,,,Groceries->Soups & Cans->Canned Meat ,,2.49,,,,,,,GSCCM081,GSCCM081.JPG,,taxable,standard-rate
Maple Leaf Chunks of Chicken 142g,,,Groceries->Soups & Cans->Canned Meat ,,2.99,,,,,,,GSCCM082,GSCCM082.JPG,,taxable,standard-rate
Compliments Flakes of Chicken 156g,,,Groceries->Soups & Cans->Canned Meat ,,1.99,,,,,,,GSCCM083,GSCCM083.JPG,,taxable,standard-rate
Maple Leaf Flakes of Chicken 156g,,,Groceries->Soups & Cans->Canned Meat ,,2.49,,,,,,,GSCCM084,GSCCM084.JPG,,taxable,standard-rate
Compliments Flakes of Ham 156g,,,Groceries->Soups & Cans->Canned Meat ,,1.99,,,,,,,GSCCM085,GSCCM085.JPG,,taxable,standard-rate
Holiday Luncheon Meat 340g,,,Groceries->Soups & Cans->Canned Meat ,,3.06,,,,,,,GSCCM086,GSCCM086.JPG,,taxable,standard-rate
Spam Luncheon Meat Light 340g,,,Groceries->Soups & Cans->Canned Meat ,,4.49,,,,,,,GSCCM087,GSCCM087.JPG,,taxable,standard-rate
Spam Luncheon Meat 340g,,,Groceries->Soups & Cans->Canned Meat ,,4.49,,,,,,,GSCCM088,GSCCM088.JPG,,taxable,standard-rate
Compliments Chunk Light Tuna in Water 1.02Kg 6Pk,,,Groceries->Soups & Cans->Canned Meat ,,6.79,,,,,,,GSCCM089,GSCCM089.JPG,,taxable,standard-rate
Unico Solid Tuna 99g,,,Groceries->Soups & Cans->Canned Meat ,,1.49,,,,,,,GSCCM090,GSCCM090.JPG,,taxable,standard-rate
Compliments Turkey Breast Chunks 142g,,,Groceries->Soups & Cans->Canned Meat ,,2.49,,,,,,,GSCCM091,GSCCM091.JPG,,taxable,standard-rate
Compliments Flakes of Turkey 156g,,,Groceries->Soups & Cans->Canned Meat ,,1.99,,,,,,,GSCCM092,GSCCM092.JPG,,taxable,standard-rate
Maple Leaf Flakes of Turkey 156g,,,Groceries->Soups & Cans->Canned Meat ,,2.49,,,,,,,GSCCM093,GSCCM093.JPG,,taxable,standard-rate
Maple Leaf Flakes of Ham 156g,,,Groceries->Soups & Cans->Canned Meat ,,2.49,,,,,,,GSCCM094,GSCCM094.JPG,,taxable,standard-rate
Maple Leaf Flakes of Ham Less Salt 156g,,,Groceries->Soups & Cans->Canned Meat ,,2.49,,,,,,,GSCCM095,GSCCM095.JPG,,taxable,standard-rate
Hereford Corned Beef 340g,,,Groceries->Soups & Cans->Canned Meat ,,4.09,,,,,,,GSCCM096,GSCCM096.JPG,,taxable,standard-rate
Hereford Chopped Ham 326g,,,Groceries->Soups & Cans->Canned Meat ,,2.99,,,,,,,GSCCM097,GSCCM097.JPG,,taxable,standard-rate
Swift Premium Cooked Ham 454g ,,,Groceries->Soups & Cans->Canned Meat ,,6.29,,,,,,,GSCCM098,GSCCM098.JPG,,taxable,standard-rate
Callipo Solid Light Tuna in Olive Oil 3Pk 240g,,,Groceries->Soups & Cans->Canned Meat ,,4.99,,,,,,,GSCCM099,GSCCM099.JPG,,taxable,standard-rate
Unico Solid Light Tuna in Olive Oil 240g 3Pk,,,Groceries->Soups & Cans->Canned Meat ,,4.99,,,,,,,GSCCM100,GSCCM100.JPG,,taxable,standard-rate
Unico Solid Light Tuna 198g,,,Groceries->Soups & Cans->Canned Meat ,,2.55,,,,,,,GSCCM101,GSCCM101.JPG,,taxable,standard-rate
