title,description,short_description,category,stock,price,regular_price,sales_prices,weight,length,width,height,sku,picture,tags,tax_status,tax_class
Glad Roomate Kitchen Catchers Bags Fresh Clean Scent 52Pk,,,Home & Lifestyle->Home Supplies->Garbage Bags,,6.59,,,,,,,HLHSGB001,HLHSGB001.JPG,,taxable,standard-rate
Glad Kitchen Tie'n Toss Catchers Bags Regular 36Pk,,,Home & Lifestyle->Home Supplies->Garbage Bags,,6.59,,,,,,,HLHSGB002,HLHSGB002.JPG,,taxable,standard-rate
Glad Kitchen Catchers Bags Regular 100Pk,,,Home & Lifestyle->Home Supplies->Garbage Bags,,10.49,,,,,,,HLHSGB003,HLHSGB003.JPG,,taxable,standard-rate
Glad Giant Garbage Bags 40Pk,,,Home & Lifestyle->Home Supplies->Garbage Bags,,19.99,,,,,,,HLHSGB004,HLHSGB004.JPG,,taxable,standard-rate
Glad Extra Large Garbage Bags 20Pk,,,Home & Lifestyle->Home Supplies->Garbage Bags,,12.49,,,,,,,HLHSGB005,HLHSGB005.JPG,,taxable,standard-rate
Glad Forceflex Tall Kitchen Catchers Bags 22Pk,,,Home & Lifestyle->Home Supplies->Garbage Bags,,6.49,,,,,,,HLHSGB006,HLHSGB006.JPG,,taxable,standard-rate
Glad ForceFlex Tie'n Toss Tall Kitchen Catchers Bags 34Pk,,,Home & Lifestyle->Home Supplies->Garbage Bags,,9.99,,,,,,,HLHSGB007,HLHSGB007.JPG,,taxable,standard-rate
Glad Regular Clear Kitchen Catchers Bags Multi Purpose 48Pk,,,Home & Lifestyle->Home Supplies->Garbage Bags,,6.59,,,,,,,HLHSGB008,HLHSGB008.JPG,,taxable,standard-rate
Glad Clear Kitchen Catchers Bags Regular Fresh Clean Scent 48Pk,,,Home & Lifestyle->Home Supplies->Garbage Bags,,6.59,,,,,,,HLHSGB009,HLHSGB009.JPG,,taxable,standard-rate
Glad ForceFlex Large Garbage Bags 15Pk,,,Home & Lifestyle->Home Supplies->Garbage Bags,,6.49,,,,,,,HLHSGB010,HLHSGB010.JPG,,taxable,standard-rate
Glad Large Tie'n Toss Garbage Bags 20Pk,,,Home & Lifestyle->Home Supplies->Garbage Bags,,9.99,,,,,,,HLHSGB011,HLHSGB011.JPG,,taxable,standard-rate
Glad Tall Kitchen Catchers Bags Fresh Scent 30Pk,,,Home & Lifestyle->Home Supplies->Garbage Bags,,6.59,,,,,,,HLHSGB012,HLHSGB012.JPG,,taxable,standard-rate
Glad Large Kitchen Chatchers Bags Fresh Scent 40Pk,,,Home & Lifestyle->Home Supplies->Garbage Bags,,6.59,,,,,,,HLHSGB013,HLHSGB013.JPG,,taxable,standard-rate
Glad Large Garbage Bags 30Pk,,,Home & Lifestyle->Home Supplies->Garbage Bags,,10.99,,,,,,,HLHSGB014,HLHSGB014.JPG,,taxable,standard-rate
Glad Regular Garbage Bags 10Pk,,,Home & Lifestyle->Home Supplies->Garbage Bags,,4.92,,,,,,,HLHSGB015,HLHSGB015.JPG,,taxable,standard-rate
Glad Regular Garbage Bags 40Pk,,,Home & Lifestyle->Home Supplies->Garbage Bags,,10.99,,,,,,,HLHSGB018,HLHSGB018.JPG,,taxable,standard-rate
Glad Regular Clear Bags 40Pk,,,Home & Lifestyle->Home Supplies->Garbage Bags,,10.99,,,,,,,HLHSGB022,HLHSGB022.JPG,,taxable,standard-rate
Glad Extra Large Clear Bags 20Pk,,,Home & Lifestyle->Home Supplies->Garbage Bags,,12.49,,,,,,,HLHSGB023,HLHSGB023.JPG,,taxable,standard-rate
Compliments kitchen Garbage Bags Regular 100Pk,,,Home & Lifestyle->Home Supplies->Garbage Bags,,6.99,,,,,,,HLHSGB024,HLHSGB024.JPG,,taxable,standard-rate
Compliments Garbage Bags Extra Large 20Pk,,,Home & Lifestyle->Home Supplies->Garbage Bags,,7.99,,,,,,,HLHSGB025,HLHSGB025.JPG,,taxable,standard-rate
Compliments Kitchen Rack Refill Bags 24Pk,,,Home & Lifestyle->Home Supplies->Garbage Bags,,2.99,,,,,,,HLHSGB026,HLHSGB026.JPG,,taxable,standard-rate
Compliments Drawstring Garbage Bags Large 20Pk,,,Home & Lifestyle->Home Supplies->Garbage Bags,,6.99,,,,,,,HLHSGB027,HLHSGB027.JPG,,taxable,standard-rate
Compliments Kitchen Garbage Bags Large 40Pk,,,Home & Lifestyle->Home Supplies->Garbage Bags,,3.79,,,,,,,HLHSGB028,HLHSGB028.JPG,,taxable,standard-rate
Compliments Orange Bags Extra Large 20Pk,,,Home & Lifestyle->Home Supplies->Garbage Bags,,6.99,,,,,,,HLHSGB029,HLHSGB029.JPG,,taxable,standard-rate
Compliments Garbage Bags Regular 10Pk,,,Home & Lifestyle->Home Supplies->Garbage Bags,,2.99,,,,,,,HLHSGB030,HLHSGB030.JPG,,taxable,standard-rate
Compliments Garbage Bags Regular 40Pk,,,Home & Lifestyle->Home Supplies->Garbage Bags,,7.49,,,,,,,HLHSGB031,HLHSGB031.JPG,,taxable,standard-rate
Compliments Garbage Bags Regular 100Pk,,,Home & Lifestyle->Home Supplies->Garbage Bags,,15.99,,,,,,,HLHSGB032,HLHSGB032.JPG,,taxable,standard-rate
Compliments GreenCare Complimentsostable Small Green Bin Liners for Organic Waste 20Pk,,,Home & Lifestyle->Home Supplies->Garbage Bags,,3.99,,,,,,,HLHSGB033,HLHSGB033.JPG,,taxable,standard-rate
Compliments Recycling Blue Bags 40Pk,,,Home & Lifestyle->Home Supplies->Garbage Bags,,8.49,,,,,,,HLHSGB034,HLHSGB034.JPG,,taxable,standard-rate
Compliments Recycling Blue Bags 10Pk,,,Home & Lifestyle->Home Supplies->Garbage Bags,,3.99,,,,,,,HLHSGB035,HLHSGB035.JPG,,taxable,standard-rate
Compliments Clear Bags Regular 40Pk,,,Home & Lifestyle->Home Supplies->Garbage Bags,,6.99,,,,,,,HLHSGB036,HLHSGB036.JPG,,taxable,standard-rate
Compliments Clear Bags Extra Large 20Pk,,,Home & Lifestyle->Home Supplies->Garbage Bags,,6.99,,,,,,,HLHSGB037,HLHSGB037.JPG,,taxable,standard-rate
Bag to Earth Compostable Food Waste Bags Large 5Pk,,,Home & Lifestyle->Home Supplies->Garbage Bags,,7.47,,,,,,,HLHSGB038,HLHSGB038.JPG,,taxable,standard-rate
Bag to Earth Kitchen Organic Waste Compostable Bags Small 10Pk,,,Home & Lifestyle->Home Supplies->Garbage Bags,,5.49,,,,,,,HLHSGB039,HLHSGB039.JPG,,taxable,standard-rate
