title,description,short_description,category,stock,price,regular_price,sales_prices,weight,length,width,height,sku,picture,tags,tax_status,tax_class
Casa Di Oliva Capers 315ml,,,"Groceries->Condiments & sauces->Pickles, Relish & Olives",,3.99,,,,,,,GCSPRO001,GCSPRO001.JPG,,taxable,standard-rate
Casa Di Oliva Mixed Grilled Bruschetta 315ml,,,"Groceries->Condiments & sauces->Pickles, Relish & Olives",,3.99,,,,,,,GCSPRO003,GCSPRO003.JPG,,taxable,standard-rate
Casa Di Oliva Tomato & Olive Bruschetta 315ml,,,"Groceries->Condiments & sauces->Pickles, Relish & Olives",,3.58,,,,,,,GCSPRO004,GCSPRO004.JPG,,taxable,standard-rate
Casa Di Oliva Roasted Red Pepper & Artichoke Bruschetta 315ml,,,"Groceries->Condiments & sauces->Pickles, Relish & Olives",,3.99,,,,,,,GCSPRO005,GCSPRO005.JPG,,taxable,standard-rate
Casa Di Oliva Green Olives Stuffed with Red Pepper 315ml,,,"Groceries->Condiments & sauces->Pickles, Relish & Olives",,3.99,,,,,,,GCSPRO008,GCSPRO008.JPG,,taxable,standard-rate
Casa Di Oliva Green Olives Stuffed with Garlic 315ml,,,"Groceries->Condiments & sauces->Pickles, Relish & Olives",,3.99,,,,,,,GCSPRO011,GCSPRO011.JPG,,taxable,standard-rate
Bick's Gherkins Pickles Sweet 375ml,,,"Groceries->Condiments & sauces->Pickles, Relish & Olives",,4.49,,,,,,,GCSPRO016,GCSPRO016.JPG,,taxable,standard-rate
Bick's Mini Crunch'ems Definitely Dill 500ml,,,"Groceries->Condiments & sauces->Pickles, Relish & Olives",,3.58,,,,,,,GCSPRO017,GCSPRO017.JPG,,taxable,standard-rate
Bick's Mini Crunch'ems Garlic Rush 500ml,,,"Groceries->Condiments & sauces->Pickles, Relish & Olives",,3.58,,,,,,,GCSPRO018,GCSPRO018.JPG,,taxable,standard-rate
Bick's Premium Sandwish Savers Pickles Extra Garlic 500ml,,,"Groceries->Condiments & sauces->Pickles, Relish & Olives",,3.58,,,,,,,GCSPRO019,GCSPRO019.JPG,,taxable,standard-rate
Bick's Premium Sandwish Savers Pickles Tangy Dill Less Salt 500ml,,,"Groceries->Condiments & sauces->Pickles, Relish & Olives",,3.58,,,,,,,GCSPRO020,GCSPRO020.JPG,,taxable,standard-rate
Bick's Premium Sandwish Savers Pickles Tangy Dill 500ml,,,"Groceries->Condiments & sauces->Pickles, Relish & Olives",,3.58,,,,,,,GCSPRO021,GCSPRO021.JPG,,taxable,standard-rate
Bick's Premium Sandwish Savers Pickles Hot'n Spicy 500ml,,,"Groceries->Condiments & sauces->Pickles, Relish & Olives",,3.58,,,,,,,GCSPRO022,GCSPRO022.JPG,,taxable,standard-rate
Bick's Premium Sandwish Savers Pickles Sweet Yum Yum 500ml,,,"Groceries->Condiments & sauces->Pickles, Relish & Olives",,3.58,,,,,,,GCSPRO023,GCSPRO023.JPG,,taxable,standard-rate
Bick's Premium Yum Yum Pickles Sweet 500ml,,,"Groceries->Condiments & sauces->Pickles, Relish & Olives",,3.58,,,,,,,GCSPRO024,GCSPRO024.JPG,,taxable,standard-rate
Bick's Premium Sweet Mix Pickles 500ml,,,"Groceries->Condiments & sauces->Pickles, Relish & Olives",,2.99,,,,,,,GCSPRO025,GCSPRO025.JPG,,taxable,standard-rate
Bick's Pickled Banana Pepper Chunks Mild 750ml,,,"Groceries->Condiments & sauces->Pickles, Relish & Olives",,3.99,,,,,,,GCSPRO026,GCSPRO026.JPG,,taxable,standard-rate
Bick's Pickled Whole Baby Beets 500ml,,,"Groceries->Condiments & sauces->Pickles, Relish & Olives",,3.29,,,,,,,GCSPRO027,GCSPRO027.JPG,,taxable,standard-rate
Bick's Pickled Sliced Beets 750ml,,,"Groceries->Condiments & sauces->Pickles, Relish & Olives",,3.49,,,,,,,GCSPRO028,GCSPRO028.JPG,,taxable,standard-rate
Bick's Dill Pickles Garlic Less Salt 1L,,,"Groceries->Condiments & sauces->Pickles, Relish & Olives",,4.09,,,,,,,GCSPRO029,GCSPRO029.JPG,,taxable,standard-rate
Bick's Dill Pickles Garlic 1L,,,"Groceries->Condiments & sauces->Pickles, Relish & Olives",,4.09,,,,,,,GCSPRO030,GCSPRO030.JPG,,taxable,standard-rate
Bick's Premium Baby Dills Pickles Garlic 1L,,,"Groceries->Condiments & sauces->Pickles, Relish & Olives",,4.59,,,,,,,GCSPRO031,GCSPRO031.JPG,,taxable,standard-rate
Bick's Premium Baby Dills Pickles Ultimate Garlic 1L,,,"Groceries->Condiments & sauces->Pickles, Relish & Olives",,4.59,,,,,,,GCSPRO032,GCSPRO032.JPG,,taxable,standard-rate
Bick's Dill Pickles No Garlic 1L,,,"Groceries->Condiments & sauces->Pickles, Relish & Olives",,4.09,,,,,,,GCSPRO033,GCSPRO033.JPG,,taxable,standard-rate
Bick's Premium Baby Dills Pickles Garlic Less Salt 1L,,,"Groceries->Condiments & sauces->Pickles, Relish & Olives",,4.59,,,,,,,GCSPRO034,GCSPRO034.JPG,,taxable,standard-rate
Bick's Premium Sweet Mix Pickles 1L,,,"Groceries->Condiments & sauces->Pickles, Relish & Olives",,4.59,,,,,,,GCSPRO035,GCSPRO035.JPG,,taxable,standard-rate
Bick's Premium Baby Dills Pickles Tangy No Garlic 1L,,,"Groceries->Condiments & sauces->Pickles, Relish & Olives",,4.59,,,,,,,GCSPRO036,GCSPRO036.JPG,,taxable,standard-rate
Bick's Pickled Banana Pepper Rings Hot 750ml,,,"Groceries->Condiments & sauces->Pickles, Relish & Olives",,3.99,,,,,,,GCSPRO037,GCSPRO037.JPG,,taxable,standard-rate
Bick's Gourmet Hot Pepper Relish 375ml,,,"Groceries->Condiments & sauces->Pickles, Relish & Olives",,2.49,,,,,,,GCSPRO038,GCSPRO038.JPG,,taxable,standard-rate
Bick's Gourmet Sweet Corn Relish 375ml,,,"Groceries->Condiments & sauces->Pickles, Relish & Olives",,2.86,,,,,,,GCSPRO039,GCSPRO039.JPG,,taxable,standard-rate
Bick's Gourmet Tangy Dill Relish 375ml,,,"Groceries->Condiments & sauces->Pickles, Relish & Olives",,2.86,,,,,,,GCSPRO040,GCSPRO040.JPG,,taxable,standard-rate
Bick's Hot Dog Relish 375ml,,,"Groceries->Condiments & sauces->Pickles, Relish & Olives",,2.35,,,,,,,GCSPRO041,GCSPRO041.JPG,,taxable,standard-rate
Bick's Hamburger Relish 375ml,,,"Groceries->Condiments & sauces->Pickles, Relish & Olives",,2.35,,,,,,,GCSPRO042,GCSPRO042.JPG,,taxable,standard-rate
Bick's Sweet Green Relish 375ml,,,"Groceries->Condiments & sauces->Pickles, Relish & Olives",,2.35,,,,,,,GCSPRO043,GCSPRO043.JPG,,taxable,standard-rate
Unico Artichoke Hearts 398ml,,,"Groceries->Condiments & sauces->Pickles, Relish & Olives",,3.49,,,,,,,GCSPRO044,GCSPRO044.JPG,,taxable,standard-rate
Unico Artichoke Hearts 170ml,,,"Groceries->Condiments & sauces->Pickles, Relish & Olives",,1.99,,,,,,,GCSPRO045,GCSPRO045.JPG,,taxable,standard-rate
Unico Mediterranean Julienne Cut Sundried Tomatoes in Oil 210ml,,,"Groceries->Condiments & sauces->Pickles, Relish & Olives",,4.29,,,,,,,GCSPRO046,GCSPRO046.JPG,,taxable,standard-rate
Unico Capers 125ml,,,"Groceries->Condiments & sauces->Pickles, Relish & Olives",,2.79,,,,,,,GCSPRO047,GCSPRO047.JPG,,taxable,standard-rate
Unico Flame Roasted Peppers Sliced 370ml,,,"Groceries->Condiments & sauces->Pickles, Relish & Olives",,4.09,,,,,,,GCSPRO048,GCSPRO048.JPG,,taxable,standard-rate
Unico Flame Roasted Peppers Whole 370ml,,,"Groceries->Condiments & sauces->Pickles, Relish & Olives",,4.09,,,,,,,GCSPRO049,GCSPRO049.JPG,,taxable,standard-rate
Unico Stuffed Manzanilla Olives 375ml,,,"Groceries->Condiments & sauces->Pickles, Relish & Olives",,2.65,,,,,,,GCSPRO050,GCSPRO050.JPG,,taxable,standard-rate
Unico Sliced Pizza Style Olives 375ml,,,"Groceries->Condiments & sauces->Pickles, Relish & Olives",,2.49,,,,,,,GCSPRO051,GCSPRO051.JPG,,taxable,standard-rate
Unico Cocktail Olives 375ml,,,"Groceries->Condiments & sauces->Pickles, Relish & Olives",,1.49,,,,,,,GCSPRO052,GCSPRO052.JPG,,taxable,standard-rate
Unico Kalamata Olives 375ml,,,"Groceries->Condiments & sauces->Pickles, Relish & Olives",,3.29,,,,,,,GCSPRO053,GCSPRO053.JPG,,taxable,standard-rate
Unico Stuffed Manzanilla Olives 750ml,,,"Groceries->Condiments & sauces->Pickles, Relish & Olives",,3.99,,,,,,,GCSPRO054,GCSPRO054.JPG,,taxable,standard-rate
Unico Jalapeno Stuffed Olives 375ml,,,"Groceries->Condiments & sauces->Pickles, Relish & Olives",,2.49,,,,,,,GCSPRO055,GCSPRO055.JPG,,taxable,standard-rate
Unico Stuffed Queens Olives 375ml,,,"Groceries->Condiments & sauces->Pickles, Relish & Olives",,3.06,,,,,,,GCSPRO056,GCSPRO056.JPG,,taxable,standard-rate
Unico Whole Ripe Olives 375ml,,,"Groceries->Condiments & sauces->Pickles, Relish & Olives",,1.59,,,,,,,GCSPRO057,GCSPRO057.JPG,,taxable,standard-rate
Unico Super Colossal Pitted Ripe Olives 375ml,,,"Groceries->Condiments & sauces->Pickles, Relish & Olives",,2.79,,,,,,,GCSPRO058,GCSPRO058.JPG,,taxable,standard-rate
Unico Sliced Ripe Olives 375ml,,,"Groceries->Condiments & sauces->Pickles, Relish & Olives",,1.59,,,,,,,GCSPRO059,GCSPRO059.JPG,,taxable,standard-rate
Unico Pitted Ripe Olives 375ml,,,"Groceries->Condiments & sauces->Pickles, Relish & Olives",,1.59,,,,,,,GCSPRO060,GCSPRO060.JPG,,taxable,standard-rate
Unico Peperoncini Peppers Pickled 750ml,,,"Groceries->Condiments & sauces->Pickles, Relish & Olives",,2.49,,,,,,,GCSPRO061,GCSPRO061.JPG,,taxable,standard-rate
Unico Pepper Rings Pickled Hot 750ml,,,"Groceries->Condiments & sauces->Pickles, Relish & Olives",,2.49,,,,,,,GCSPRO062,GCSPRO062.JPG,,taxable,standard-rate
Vlasic Zesty Dill Pickles Robust Dill & Garlic Taste 1L,,,"Groceries->Condiments & sauces->Pickles, Relish & Olives",,3.99,,,,,,,GCSPRO063,GCSPRO063.JPG,,taxable,standard-rate
Vlasic Bread & Butter Pickles Mildly Sweet & Spicy 1L,,,"Groceries->Condiments & sauces->Pickles, Relish & Olives",,3.99,,,,,,,GCSPRO064,GCSPRO064.JPG,,taxable,standard-rate
Vlasic Kosher Dill Pickles Classic Dill Taste 1L ,,,"Groceries->Condiments & sauces->Pickles, Relish & Olives",,3.99,,,,,,,GCSPRO065,GCSPRO065.JPG,,taxable,standard-rate
Vlasic Garlic Baby Kosher Dill Pickles Classic Dill & Garlic Taste 1L,,,"Groceries->Condiments & sauces->Pickles, Relish & Olives",,3.99,,,,,,,GCSPRO066,GCSPRO066.JPG,,taxable,standard-rate
Vlasic Baby Kosher Dill Pickles Classic Dill Taste 1L,,,"Groceries->Condiments & sauces->Pickles, Relish & Olives",,3.99,,,,,,,GCSPRO067,GCSPRO067.JPG,,taxable,standard-rate
Strubs Banderilla Skewers Spicy 710ml,,,"Groceries->Condiments & sauces->Pickles, Relish & Olives",,5.12,,,,,,,GCSPRO088,GCSPRO088.JPG,,taxable,standard-rate
Strubs Banderilla Skewers Mild 710ml,,,"Groceries->Condiments & sauces->Pickles, Relish & Olives",,5.12,,,,,,,GCSPRO089,GCSPRO089.JPG,,taxable,standard-rate
Matt Steve's B'n Olive Extreme Bean Stuffed Olive Hot & Spicy 375ml,,,"Groceries->Condiments & sauces->Pickles, Relish & Olives",,4.49,,,,,,,GCSPRO090,GCSPRO090.JPG,,taxable,standard-rate
Matt Steve's the Extreme Bean Pickled Beans Hot & Spicy 1L,,,"Groceries->Condiments & sauces->Pickles, Relish & Olives",,7.99,,,,,,,GCSPRO091,GCSPRO091.JPG,,taxable,standard-rate
Mezzetta Pitted Kalamata Olives 250ml,,,"Groceries->Condiments & sauces->Pickles, Relish & Olives",,5.49,,,,,,,GCSPRO093,GCSPRO093.JPG,,taxable,standard-rate
Mezzetta Garlic Stuffed Olives 250ml,,,"Groceries->Condiments & sauces->Pickles, Relish & Olives",,5.49,,,,,,,GCSPRO094,GCSPRO094.JPG,,taxable,standard-rate
Mezzetta Jalapeno Stuffed Olives 212g,,,"Groceries->Condiments & sauces->Pickles, Relish & Olives",,5.49,,,,,,,GCSPRO095,GCSPRO095.JPG,,taxable,standard-rate
Mezzetta Garlic Stuffed Olives 398ml,,,"Groceries->Condiments & sauces->Pickles, Relish & Olives",,6.49,,,,,,,GCSPRO096,GCSPRO096.JPG,,taxable,standard-rate
Mezzetta California Pickled Hot Chili Peppers 375ml,,,"Groceries->Condiments & sauces->Pickles, Relish & Olives",,3.49,,,,,,,GCSPRO097,GCSPRO097.JPG,,taxable,standard-rate
Mezzetta Pickled Imported Golden Greek Peperoncini 375ml,,,"Groceries->Condiments & sauces->Pickles, Relish & Olives",,3.49,,,,,,,GCSPRO098,GCSPRO098.JPG,,taxable,standard-rate
Mezzetta Deli-Sliced Tamed Jalapeno Peppers 375ml,,,"Groceries->Condiments & sauces->Pickles, Relish & Olives",,3.29,,,,,,,GCSPRO099,GCSPRO099.JPG,,taxable,standard-rate
Compliments Greek Mammoth Olives 500ml,,,"Groceries->Condiments & sauces->Pickles, Relish & Olives",,3.99,,,,,,,GCSPRO100,GCSPRO100.JPG,,taxable,standard-rate
Compliments Sliced Kalamata Olives 375ml,,,"Groceries->Condiments & sauces->Pickles, Relish & Olives",,2.99,,,,,,,GCSPRO102,GCSPRO102.JPG,,taxable,standard-rate
Compliments Artichoke Hearts 398ml,,,"Groceries->Condiments & sauces->Pickles, Relish & Olives",,2.99,,,,,,,GCSPRO103,GCSPRO103.JPG,,taxable,standard-rate
Compliments Greek Mammoth Stuffed Olives 500ml,,,"Groceries->Condiments & sauces->Pickles, Relish & Olives",,3.99,,,,,,,GCSPRO104,GCSPRO104.JPG,,taxable,standard-rate
Compliments Stuffed Manzanilla Olives 375ml,,,"Groceries->Condiments & sauces->Pickles, Relish & Olives",,1.79,,,,,,,GCSPRO105,GCSPRO105.JPG,,taxable,standard-rate
Compliments Whole Queen Olives 375ml,,,"Groceries->Condiments & sauces->Pickles, Relish & Olives",,1.79,,,,,,,GCSPRO106,GCSPRO106.JPG,,taxable,standard-rate
Compliments Sliced Green Olives 375ml,,,"Groceries->Condiments & sauces->Pickles, Relish & Olives",,1.79,,,,,,,GCSPRO107,GCSPRO107.JPG,,taxable,standard-rate
Compliments Sweet Pickled Onions 375ml,,,"Groceries->Condiments & sauces->Pickles, Relish & Olives",,1.99,,,,,,,GCSPRO108,GCSPRO108.JPG,,taxable,standard-rate
Compliments Sandwish Sliced Bread & Butter Pickles 500ml,,,"Groceries->Condiments & sauces->Pickles, Relish & Olives",,2.29,,,,,,,GCSPRO110,GCSPRO110.JPG,,taxable,standard-rate
Compliments Baby Dill Pickles 1L,,,"Groceries->Condiments & sauces->Pickles, Relish & Olives",,2.49,,,,,,,GCSPRO111,GCSPRO111.JPG,,taxable,standard-rate
Compliments Bread & Butter Pickles 1L ,,,"Groceries->Condiments & sauces->Pickles, Relish & Olives",,2.49,,,,,,,GCSPRO112,GCSPRO112.JPG,,taxable,standard-rate
Compliments Essential Polski Ogorkie Dill Pickles 1L,,,"Groceries->Condiments & sauces->Pickles, Relish & Olives",,2.49,,,,,,,GCSPRO113,GCSPRO113.JPG,,taxable,standard-rate
Compliments Sweet Mixed Pickles 1L,,,"Groceries->Condiments & sauces->Pickles, Relish & Olives",,2.49,,,,,,,GCSPRO114,GCSPRO114.JPG,,taxable,standard-rate
Compliments Sweet Green Relish 500ml,,,"Groceries->Condiments & sauces->Pickles, Relish & Olives",,1.99,,,,,,,GCSPRO116,GCSPRO116.JPG,,taxable,standard-rate
